,Unnamed: 0,Unnamed: 0.1,text_id,text,task_1,task_2,task_3,label
2572,406,406,hasoc_hi_1666,और ये काम कौन करेगा?   आप लोग रिपोर्टिंग तो करते नहीं   राजनीति करते हो  अब उनको पार्टी से बाहर निकालो   आपके गाँड फादर का निर्देश मिल गया है   कब निकालेंगे उनको पार्टी से?  @manakgupta,HOF,HATE,TIN,0
2491,440,440,hasoc_hi_1442,भोसडीके corruption is corruption!!! Wherw the f*** does caste comes into play???,HOF,PRFN,UNT,1
3647,3325,3325,hasoc_hi_3099,देशद्रोही मुसलमान सूअर को पाक भेजो ,HOF,HATE,TIN,0
1899,1091,1091,hasoc_hi_270,रात को #रजाई ने फिर ताना मार दिया     बोली #कमीने इस साल भी अकेला ही,NOT,NONE,NONE,2
676,95,95,hasoc_hi_3742,"1971 के बाद देश ने पहली बार एक सरकार को प्रो इंकम्बेंसी जनादेश दिया है।    ये जीत सच्चाई की जीत है, भारत के लोकतंत्र की जीत है: पीएम मोदी जी ।",NOT,NONE,NONE,2
132,3934,3934,hasoc_hi_3157,आराम से....    अब क्या टीवी में घुस कर मरोगी उस संघी चाची को....,HOF,OFFN,UNT,1
2867,2720,2720,hasoc_hi_7238,अपनी दीदी को बोलो कभी मेरा हिन्दू लुंड भी ट्राय करे।।,HOF,PRFN,UNT,1
894,3837,3837,hasoc_hi_5759,"आतंकवाद की आरोपी #साध्वी_प्रज्ञा को चुनाव लड़ने के लिए जमानत मिल जाती है,  मगर पूर्व सांसद #अतीक_अहमद की पैरोल अर्ज़ी हाई कोर्ट से ख़ारिज़ कर दी जाती है..     ये कहाँ का न्याय है मी लॉर्ड!",NOT,NONE,NONE,2
2072,4196,4196,hasoc_hi_5255,तू सही से पढ़ लिया कर रंडि साली,HOF,PRFN,TIN,1
815,3692,3692,hasoc_hi_2403,"कालनेमि,  जिन चीजों पे खतरा मंडरा रहा है:  @RahulGandhi @ArvindKejriwal @msisodia @BDUTT @Shubhrastha @TajinderBagga @AnupamPKher @AmitShah   लश्कर  जैश  कांग्रेस  टुकड़े टुकड़े गैंग  अर्बन नक्सल  वामपंथी  गाली गैंग  धारा 370  35A  अवार्ड वापसी गैंग  पत्थरबाज  देशद्रोही  सिमी  हुर्रियत",HOF,HATE,TIN,0
2990,2752,2752,hasoc_hi_2085,जो @abhisar_sharma को कांग्रेसी पत्रकार कहते है उन अनपढो को यही कहूंगा 2014 के पहले की एंकरिंग देखे।    अभिसार सर जैसे पत्रकार तब भी सत्ताधारी से सवाल करते थे और अब भी करते है आगे भी करेंगें।    पत्रकार का मतलब सरकार से सवाल करना होता है?न कि हिन्दू-मुस्लिम करके सरकार का पक्ष लेना।,HOF,HATE,TIN,0
2013,1251,1251,hasoc_hi_136,सही एकदम इसलिये इंसानियत को मरने मत दो,NOT,NONE,NONE,2
1994,1171,1171,hasoc_hi_4759,नाम के आगे गर्व से #मैं_भी_चौकीदार' लिखने वालों को अब  शर्म से '  #मैं_भी_जिम्‍मेदार' भी लिख लेना चाहिए,HOF,HATE,TIN,0
2487,1826,1826,hasoc_hi_1586,"हम भारतीय बासी रोटी तो खा सकते हैं किन्तु ये 5साल पुराना बासी,बेकार,और झूठा भा ज पा का जुमला मेनिफेस्तो हजम नही हो पायेगा ।जनता इस बार इस फरेबी पार्टी को सिरे से नकार  देगी @YasirS_Alig @AqdasShaikh_sp @ANWARKhanWarsi2 @samajwadiparty @ItCellSpLko @YasarShahFan @arisudan11",HOF,HATE,TIN,0
4015,1935,1935,hasoc_hi_1101,अतंकी #प्रज्ञा_ठाकुर खुद को संत कहला सकती है तो आजाद #भारत के पहले आतंकी #गोडसे को देश भक्त क्यों नही कह सकती?   #मोदी_है_तो_मुमकिन_है     @alamgirizvi @ModiLeDubega @Dilsedesh @Anjupra7743 @KPadmaRani1  @KPadmaRani1 @KumariRukshmani,HOF,HATE,TIN,0
3724,2190,2190,hasoc_hi_4577,मादरचोद झूट नही है ये।।भोसडीके तुम साले कटवे होते हो हरामी हो,HOF,PRFN,TIN,1
1948,572,572,hasoc_hi_3455,देखो हमारी दीदी को मोबाइल चलाते राहुल गांधी दिख गए लेकिन 200 बच्चों मौत पे खामोस मोदी नही दिखे?    ऐसे पत्रकारों को PMO ऑफिस मे 4 घंटे ट्रेनिंग दी जाती है विपक्ष की छोटी-छोटी बातों का बतंगड़ बनाने के लिए।    लगी रहो बहिंन जी देशहित को बर्बाद करने में तुम्हारा नाम भी याद किया जाएगा।,NOT,NONE,NONE,2
2113,59,59,hasoc_hi_2753,बस इतनी सी बात काफी है हमारे ताअर्रुफ़ में ~  हुकूमत डर के हर रोज़ नया ठिकाना बदलती है ~,NOT,NONE,NONE,2
3370,3045,3045,hasoc_hi_2531,Every day may not be good but there is something good in every day.,NOT,NONE,NONE,2
1907,3075,3075,hasoc_hi_3393,#AIMIM MLA Adv @warispathan Attend Eid Milan Event. Organised By Police Family Welfare Committee And #ShansherKhan Sahab.,NOT,NONE,NONE,2
2519,3094,3094,hasoc_hi_6393,English Wala pyaar se maarta hai Hindi waaala गान्ड maardeta hai.,HOF,PRFN,UNT,1
327,4242,4242,hasoc_hi_4317,"क्या बे #कटुए #कुत्ते, तू क्यों भौंक रहा है??   #पोर्किस्तान के निवासी",HOF,HATE,TIN,0
1532,1616,1616,hasoc_hi_1589,#ईदमुबारक हो दोस्तों     #EidMubarak #EidUlFitr     @DrKumarVishwas @BajpayeeManoj,NOT,NONE,NONE,2
146,1833,1833,hasoc_hi_6840,भाभी ने देवेर से चूदाइ करवाई ,HOF,PRFN,UNT,1
3925,3086,3086,hasoc_hi_2492,उमपा के नए सभागृह नेता बने शेरी लुंड ! | first headlines india http://www.firstheadlinesindia.com/2019/05/blog-post.html?m=1 …,NOT,NONE,NONE,2
3884,3391,3391,hasoc_hi_1943,"@asadowaisi जायरा वसीम ने कहा 'इस्लाम में अभिनय हराम'है  तो क्या मीनाकुमारी, मधुबाला सायराबानों, शबानाआजमी, सलमान, शाहरुख सब  हरामी हैं ?इस पर ओवेसी साहब आप का क्या कहना है।",HOF,HATE,TIN,0
2080,4144,4144,hasoc_hi_816,डेल्ही का सबसे बड़ा उत्पादक सुरों सूअर का कजरी खान ,HOF,OFFN,TIN,1
3623,3055,3055,hasoc_hi_1854,"Bhaiya, Buaa ke sath agla kadam chaloge to Mulayam chacha kiske sath chalenge.... Result kuchh bhi aaye chacha ke arman to poore krwa do... Ek baar guest house me buaa ko chacha se milwa to do...Jai mulayam chacha ko.....",HOF,OFFN,UNT,1
3663,4262,4262,hasoc_hi_5976,"AMU को बीते साढे चार साल मे लगातार निशाना बनाया गया है। अब फिर से AMU मीडिया के ट्रोल्स और बजरंग दल के निशाने पर है। AMU पर विपक्ष का कोई नेता जुबान नही खोल पाया है, सिर्फ भीम आर्मी ने आवाज़ उठाई है। भाई @BhimArmyChief का AMU के लिये आवाज उठाने के लिये बहुत बहुत शुक्रिया।",HOF,OFFN,UNT,1
3340,3653,3653,hasoc_hi_4523,"चीन के सहारे चल रही अर्थव्यवस्था, फिर भी दिखा दिए तेवर.",NOT,NONE,NONE,2
309,2254,2254,hasoc_hi_5342,ट्विटर पर #चमचों की हालत हाथी को देखकर भोकने वाले कुत्तों जैसी हो गई है। जो पूछ पिछवाड़े में दबाए भागते रहते है लेकिन भौ भौं करना बंद नहीं करते। आखिर है तो #कुत्ते ही। आदत से बाज कैसे आ सकते है।  उखड़ना उनसे है नहीं कुछ हाथी का।  #चमचे,HOF,OFFN,TIN,1
244,12,12,hasoc_hi_1803,"डॉ. मुखर्जी ने एक देश में दो विधान दो प्रधान और दो निशान का विरोध करते हुए कश्मीर को भारत का अभिन्न अंग मानकर परमिट राज को खत्म करने की लड़ाई लड़ी, उनके बलिदान से ही परमिट राज खत्म हुआ- श्री @ManojTiwariMP",NOT,NONE,NONE,2
3865,2890,2890,hasoc_hi_2165,"ये फ़ोटो देखकर तो Lutyens Aunty like सागरिका घोष, शोभा डे, बरखा दत्त, अर्फा खानूम शेरवानी, पल्लवी घोष जैसों का कलेजा फटकर हाथ में आ जाएगा।  #AmitShah",NOT,NONE,NONE,2
2016,4365,4365,hasoc_hi_5256,सिर कटते थे धड़ लड़ते थे_____हिहिहिहि   ऐसे सूरमा थे तो गुलामी कैसे आयी ??  जय भीम....  जय संविधान...,NOT,NONE,NONE,2
2892,2013,2013,hasoc_hi_747,तू #कुत्ते का नही #बिल्ली का #बच्चा है   कुत्ता वफ़ादार होता है   पर तू #बिल्ली का #बच्चा है जो सोचता है #मालिक कब जाए और मैं सब खा जाऊँ..???     BC.. तू कब #देश के #ख़िलाफ़ बोलना छोड़ेगा #बिल्ले,HOF,PRFN,UNT,1
2131,3083,3083,hasoc_hi_7034,#झारखण्ड उग्र हिंसक हिन्दू भीड़ का शिकार हुए #तबरेज_अंसारी का परिवार इंसाफ की मांग कर रहा है क्या इंसाफ मिलेगा??    देखोगे तो हर मोड़ पे मिल जाएँगी #लाशें     ढूँडोगे तो इस शहर में #क़ातिल न मिलेगा     @ZarfOfficial @RiituS @mpchalia @ziddy_zoya @LambaAlka @SapnaAgrahari1,HOF,HATE,TIN,0
1420,194,194,hasoc_hi_6796,"हरामी में कौन सा कलर होता है?  शांतिदूत भी बता देंगे, लेकिन तुमसे ना बोला जाएगा दल्ले।    ",HOF,PRFN,UNT,1
2646,1198,1198,hasoc_hi_469,"जब राम रहीम बलात्कारी बाबा पैरोल पर बाहर आ सकता है  तो  14 साल से जेल में बंद शहाबुद्दीन साहब और  अतीक अहमद, मुख्तार अंसारी, बाहर क्यों नहीं आ सकते हैं!  @roflfact @AbbasAnsari_786",NOT,NONE,NONE,2
3643,3205,3205,hasoc_hi_7444,कुछ हरामि गद्दारों की वजह से पिछड़ता हुआ  हमारे हिंदुस्तान का स्वर्ग ,HOF,HATE,TIN,0
1946,2732,2732,hasoc_hi_5420,#Israel की शराब कंपनी माका ब्रेवरी ने राष्ट्रपिता #MahatmaGandhi का अपमान किया है। कंपनी ने अपनी शराब की बोतलों और केनों पर महात्मा गांधी के चित्र छापे हैं। कंपनी की करतूत पर कड़ी आपत्ति जताई गई है।,HOF,HATE,TIN,0
166,2264,2264,hasoc_hi_166,"इस पोस्ट पर सब हरामी मुल्ले सुलग गये, अल्लाह को सिनेमा पसंद नही,  चांदनी चौक पे कुछ नही बोलेंगे सुवर की औलादे, हिंदू समझ ले कोई मुल्ला भाई वाई नहीं हैं,  ",HOF,HATE,TIN,0
1745,1767,1767,hasoc_hi_2248,"प्रिय अंजना ॐ मोदी,  कृपया माइक को डाक्टर और नर्स के मुँह में मत घुसेड़िए, अगर औक़ात है तो मिनिस्टर और सीएम के पास जाकर सवाल कीजिए. यहाँ चिल्ला कर कुछ नहीं होगा, पब्लिक सारी नौटन्की समझती है. वैसे बेटा जिनके सामने झुक कर सलामी ठोकती हो उनसे सवाल करना मुश्किल ही नहीं नामुमकिन है।",HOF,OFFN,TIN,1
3928,4437,4437,hasoc_hi_3632,कांग्रेस पार्टी पहले विशेष पार्टी हुआ करती थी फिर शेष पार्टी हो गयी और अबतो अवशेष पार्टी ही ही बची है आग् आगे देखो होता है क्या   जय हो मोदी राज,HOF,OFFN,TIN,1
3215,2769,2769,hasoc_hi_3620,BSDK मोलाना पहले कहाँ मर गया था तु जब मंदिर में कत्तवों ने तोड़ फ़ोड़ की थी   हरामी सूवर के बच्चे,HOF,PRFN,TIN,1
1278,3241,3241,hasoc_hi_3313,"विधायक बेटे को लेकर बोले कैलाश विजयवर्गीय- ‘आकाश कच्चे खिलाड़ी, अधिकारियों को भी समझना चाहिए’  #KailashVijayvargiya   https://abpnews.abplive.in/india-news/bjp-leader-kailash-vijayvargiya-on-his-son-and-bjp-mla-akash-vijayvargiya-1157743 …",NOT,NONE,NONE,2
208,1919,1919,hasoc_hi_3257,#नीच कहने पर मणिशंकर को निष्कासित कर दिया गया था #बापू के हत्यारे #GODSE को देशभक्त कहने पर क्या #प्रज्ञा भी निष्कासित होंगी ? @AmitShah @RahulGandhi,HOF,HATE,TIN,0
1254,3015,3015,hasoc_hi_5646,बाई कडून पैसा घेणाऱ्याला शुद्ध मराठीत भडवा म्हणतात   पटलं तर like करा ।,HOF,PRFN,UNT,1
3265,4520,4520,hasoc_hi_7591,"अंधेरी “रात” में दूसरे देश के घने जंगलों में,  आतंकवादीयों का मोबाइल “नेटवर्क” ढूँढ लेते हैं, लेकिन “पुलवामा” में RDX कहाँ से आया ये नहीं पता,अंतरिक्ष में सुई की नोंक की बराबर Target ढूँढ लेते हैं, लेकिन “4” दिन से एक “जहाज़” नहीं ढूँढ पाये.",HOF,HATE,UNT,0
1041,1162,1162,hasoc_hi_4412,कुछ सूअर की नाज़ायज़ औलाद दिल्ली को तालिबान बता और बना रहे हैं... #निकम्मी_मोदी_सरकार,HOF,OFFN,TIN,1
1807,3260,3260,hasoc_hi_2760,"अशफाक उल्ला खां वंदेमातरम गा करके फांसी चढ़ गये सपा सांसद और ओबैसी  वंदेमातरम को इस्लाम के खिलाफ बता रहा,    ये कौन से मुसलमान है? ",HOF,HATE,TIN,0
3630,3040,3040,hasoc_hi_1164,"का बे! औक़ात का है तुम्हारी ? हैसियत का है तुम्हारी ? हिम्मत कैसे हुई बाप से सवाल करने की ?  जिनके चरणो में नतमस्तक थे, उन्ही लोगों ने कह के ले ली गोदी मीडिया के दलाल पत्रकारो की ",NOT,NONE,NONE,2
1639,4285,4285,hasoc_hi_3962,"प्रियाजी, #Media420 की नमक हरामी की हद तब पार हुई ,जब पाकिस्तान में नाबालिग हिंदू बच्ची का मुस्लिम ने अपहरण करके उसे इस्लाम धर्म अपनाने के लिए मजबूर किया  , इस बारे मे ना तो मीडिया ने मुंह खोला और ना ही सरकार द्वारा कोई ठोस कदम उठाया गया|",HOF,HATE,TIN,0
2255,844,844,hasoc_hi_5736,#Eng वालों को बधाई और #Pakistan की चूदाई,HOF,PRFN,TIN,1
3387,441,441,hasoc_hi_160,"एसपी सांसद एसटी हसन ने किया जायरा वसीम का समर्थन, फिल्म अभिनेत्रियों की तुलना तवायफ से कर डाली  via @NavbharatTimes: http://app.nbt.in  #ZahiraWasim के चक्कर मे इस कटुऐ ने ⁦@abuasimazmi⁩ आज़मी की बहु को रंडी बना दिया  ",HOF,PRFN,TIN,1
500,2530,2530,hasoc_hi_728,ऊसके मुंह में कटा हुआ जो ठुसा है।कैसे बोलेगा हरामी। ,HOF,HATE,UNT,0
3095,3566,3566,hasoc_hi_467,राम मंदिर : हम तो कोर्ट का फैसला मानेंगे  रॉफेल : हम कोर्ट का फैसला क्यों माने     कितने उत्तम क्वालिटी के #कमीने हैं ये #काग्रेसी ।,HOF,HATE,TIN,0
3351,3028,3028,hasoc_hi_143,भोसडीके ये अफवाह नही सत्य है। 8% होकर सारे दलितों का हिस्सा खा रहे हो तुम लोग,HOF,PRFN,UNT,1
1330,835,835,hasoc_hi_6058, फिर तो गुस्से में दादाजी रहे होंगे।।,NOT,NONE,NONE,2
365,964,964,hasoc_hi_7161,"नंद नगरी थाने के पास सब्जी मंडी में शनिवार रात आग लगी, इससे 250 से अधिक दुकानें जलकर राख हो गई, कल रोड शो के दोरान सूचना मिलते ही बाक़ी निर्धारित कार्यक्रम रद कर पीड़ित दुकानदारों से मिलने पहुंचा  उचित मुआवजा दिलाएँगे और सब जल्द दुकान से व्यापार कर पाएँगे..",NOT,NONE,NONE,2
2711,3762,3762,hasoc_hi_4566,सुना है वो गद्दार पकडा गया दोस्तो जिसने 44 जवानों का सौदा किया था  मगर एक हिंदू ब्राह्मण संदीप शर्मा निकला ?  जम्मू कश्मीर    @i_marwadi @yadavdimples @Anjupra7743 @MLArajeshSP,HOF,HATE,TIN,0
3726,1046,1046,hasoc_hi_515,क्या कोई हरामी पत्रकार बता सकता है कि #ZairaWasim के बॉलीवुड छोड़ने से आपका या किसी ओर का क्या नुकसान है ?  अगर नुकसान नही है तो फिर तुम भड़वों की तरह रंडी रोना क्यों रो रहे हो ?    @anjnaomkashyap @manakgupta @sardanarohit @AMISHDEVGAN,HOF,PRFN,TIN,1
3937,1026,1026,hasoc_hi_4428,#प्रज्ञा_ठाकुर का बयान घृणा लायक है. समाज ऐसा बयान कभी स्वीकार नहीं करेगा. प्रज्ञा को कभी मन से नहीं माफ कर पाऊंगा।  - पीएम नरेंद्र मोदी,NOT,NONE,NONE,2
1527,3384,3384,hasoc_hi_1225,"Emotional moment for me personally to see plight of Valmiki Community in Jammu & Kashmir being discussed in parliament. Most discriminated. As per Article 35A, Valmiki Community in Kashmir can only be 'Safai Karamcharis'. No other Govt job. Imagine the mindset of ruling elite.",HOF,HATE,TIN,0
2368,1676,1676,hasoc_hi_6613,"तुम तो पाषाण से देवता हो गए  पूजने का भी हक मुझको मिल ना सका,  कौन दर्शन करे, कौन पूजन करे  ये भी दुनिया के लोगों ने निश्चित किया  राम ने स्पर्श से जिंदा तो कर दिया  पर अहिल्या शिला थी, शिला ही रही !!!  #हिंदी #हिंदी_शब्द #काव्य_कृति  पूरी कविता मेरे ब्लॉग पर - https://meenashharma.blogspot.com/2019/06/blog-post_29.html?spref=tw …",NOT,NONE,NONE,2
714,205,205,hasoc_hi_765,भेनचोद ये क्या चूतियापा हो रहा है? ,HOF,PRFN,UNT,1
2710,4519,4519,hasoc_hi_1680,एक मुसलमान अपनी पत्नी तलाक़ देकर भी छोड़ दें तो तीन साल की सज़ा     एक हिन्दू अपनी पत्नी को बिन तलाक़ दिए ही छोड़ दें तो प्रधानमंत्री भी बन सकता है.. @RubikaLiyaquat    ये कैसा इंसाफ है..।।    इंसाफ़ के लिए RT करे..,HOF,HATE,UNT,0
3393,1781,1781,hasoc_hi_6870,"मोहम्मद सामी ने भारत को जिताया  ताली बजाने वालों में कुछ लोग वो भी थे जो कहते हैं हिंदुस्तान में रहना होगा तो वंदेमातरम कहना होगा,,",NOT,NONE,NONE,2
115,3407,3407,hasoc_hi_7763,आपने सुना है कि किसी सूअर को खाना हजम हो जाए सूअर को कितना ही खाना खिला दो वह खाएगा तो गू,HOF,OFFN,UNT,1
2763,2793,2793,hasoc_hi_4138,खेजरीवाल की गांड फट गई है उनकी वोट बैंक है कयोकी खेजरीवाल मुल्ला की हलाला सेपैदा हुई औलाद है इसलिए वह कुछ भी कर सकता है,HOF,PRFN,TIN,1
3491,1901,1901,hasoc_hi_2287,राजस्थान: पहलू खान पर जांच में गड़बड़ी पाई जाती है तो दोबारा होगी इंक्वायरी- अशोक गहलोत     https://abpnews.abplive.in/india-news/rajasthan-cm-ashok-gehlot-says-if-needed-pehlu-khan-case-will-be-re-investigate-1156966 …,NOT,NONE,NONE,2
