,Unnamed: 0,Unnamed: 0.1,text_id,text,task_1,task_2,task_3,label
1076,3018,3018,hasoc_hi_4670,हां तेरे लिए तो सब एक होंगे ही आखिर तुझे मुल्लों के तलवे चाटते हुए वोट जो लेने हैं। हां अगर ये हमला किसी मस्जिद पर हुआ होता तो घाघरा उठाकर वो रंडी रोना चालू होता जो चुनाव तक नहीं थमता।,HOF,PRFN,UNT,1
505,1659,1659,hasoc_hi_1201,झाँसी राज्य को ब्रिटिश शासन में मिलाने की घोषणा पर रानी लक्ष्मीबाई गरज कर बोली कि  “मैं अपनी झाँसी नहीं दूंगी”  #लक्ष्मीबाई,NOT,NONE,NONE,2
2917,4600,4600,hasoc_hi_5051,चलिए मानक जी धोनी के ग्लब्स में से निकल गए? लेक़िन दलाली के नदी से नही निकल पाए??    विपक्ष को छोटी-छोटी बात पे कोसने वाले एक हफ़्ते से 13 कर्मियों के साथ गायब विमान पे सरकार से सवाल नही कर सकें।    खैर छोड़िए एक ट्वीट करके इन्होंने पात्रकारिकता पे एहसान कर दिया है।,HOF,HATE,TIN,0
58,199,199,hasoc_hi_7094,Akhilesh tum akliyt samaj k liye sanghrs kro,NOT,NONE,NONE,2
3599,1645,1645,hasoc_hi_4407,मालनी भाभी की आफिस की दोस्त ने चुदाई की 10 ,HOF,PRFN,TIN,1
2028,3195,3195,hasoc_hi_4730,अपनी फालतु बकवास बंद कर और ज्ञान मत दे सबको पता है ये हरामी मुल्लो ने किया है। यही अगर उल्टा हुआ होता तब तेरा असली चेहरा दिखता तुम लोगो को कोई भाव भी नहीं पूछता सिर्फ लोगो की भड़ास निकालने के लिए रखे हुवे हो।,HOF,HATE,TIN,0
2879,3830,3830,hasoc_hi_1324,कांग्रेस मुस्लिम #लीग से #गठबंधन करे तो गलत तुम #पीडीपी से करो तो #सही     कितने #कमीने हो #बे #तुम सब  @RoflSinha @BJP4India @yadavakhilesh @INCIndia @narendramodi @AcharyaPramodk  @anuacharya @aajtak @DrKumarVishwas @RahulGandhi #BJP_भगाओ_देश_बचाओ @yadavtejashwi @LalluSinghBJP,HOF,PRFN,TIN,1
4167,928,928,hasoc_hi_4830,#Maharashtra  में लगातार हो रही बारिश अब वहां के लोगों के लिए आफत बन गई है। #Mumbai के कई इलाकों में पानी भर गया है. स्थित का अंदाजा इसी बात से लगाया जा सकता है कि प्रशासन ने एक दिन सार्वजनिक छुट्टी का एलान कर दिया है।  #MumbaiRain #MumbaiRains,NOT,NONE,NONE,2
1924,3674,3674,hasoc_hi_96,आजम खान कुछ भी बोलता है । इस मादरचोद को उड़ा दो साले को ।,HOF,PRFN,TIN,1
3014,3206,3206,hasoc_hi_534,#ब्रेकिंग_न्यूज़     #सायरा_वसीम ने मुस्लिम कलाकारों को हरामी बताया ,HOF,HATE,UNT,0
2545,2748,2748,hasoc_hi_1132,पाजी मुझे तो ये लग रहा है कि बांग्लादेशी भी पाकिस्तानियो को पेल ही देगे ओर टैब आएगा बड़ा वाला मजा।  ओर देखना इनके भिखमंगे मुल्क में कैसे विधवा विलाप होता है।    मुझे बड़ी राहत मिलती है जब ये लोग विधवा विलाप करते है रंडी रोना रोते है मुंह फाड़ फाड़ कर।,HOF,HATE,TIN,0
290,1073,1073,hasoc_hi_6149,"दिल्ली के कई हिस्सों में पानी की भारी कमी है, केजरीवाल बताएँ उन्होंने जनता को इससे निजात दिलाने के लिए क्या किया ?- श्री @ManojTiwariMP",NOT,NONE,NONE,2
3963,1049,1049,hasoc_hi_4021,Waysy tottiveer Kya KR RHA hai.. ab tho koyi kaam bacha hi nhi tho business krny k preparation KR lyga tho behter hoga...,NOT,NONE,NONE,2
2020,1641,1641,hasoc_hi_5365,ये भडवा हे साला   हर वक्त मुंह से उल्टी करता रहता है,HOF,PRFN,TIN,1
701,926,926,hasoc_hi_541,ब्राह्मणों के नाम पे बदनुमा दाग तिवारी,HOF,OFFN,TIN,1
3079,1137,1137,hasoc_hi_5054,वंदेमातरम पर राजनीति करने वाले अगर बिना देखे 'वन्देमातरम' पूरा गीत गा दें।  तब मैं उन्हें दिल से सेल्यूट करूँगा।  नहीं तो धिक्कार है  @Anjupra7743,HOF,HATE,TIN,0
977,4347,4347,hasoc_hi_6952,खुल कर @asadowaisi की पार्टी को आतंकी पार्टी बोलने वाले राजा भैया को सलाम हैं    ये एक इस्लामी पार्टी है जिससे ये साबित हो जाता है कि इस्लाम ही आतंकवाद और वहाबिसम कि जड़ है    जब तक इस देश से इस्लाम बहार नही हो जाता तब तक इस देश मे शांति बहाल नही हो सकती     जय श्री राम,HOF,HATE,TIN,0
1111,1161,1161,hasoc_hi_7543,#नीच कहने पर मणिशंकर को निष्कासित कर दिया गया था #बापू के हत्यारे #GODSE को देशभक्त कहने पर क्या #प्रज्ञा भी निष्कासित होंगी ? @AmitShah @RahulGandhi  @SadhviPragya_MP   @narendramodi   ,HOF,HATE,TIN,0
3031,1985,1985,hasoc_hi_3035,मदरसों के नाम से गांड़ में मिर्ची क्यों लगती है।,HOF,PRFN,UNT,1
1204,321,321,hasoc_hi_4641,"दिल्ली के 7 MP इनके हैं, दिल्ली पुलिस इनकी है। केंद्र में सरकार इनकी बैठी है।  अब अगर वहाँ सुअर 'अल्लाह हू अकबर' बोलकर एक मंदिर में तोड़फोड़ करते है। कहीं मीडिया में कोई खबर नही। ये कौन सा सबका साथ, सबका विकास है ??",HOF,HATE,TIN,0
3743,3481,3481,hasoc_hi_5073,हरामी की ओलाद तेरे जिहादी मुलो ने मंदिर तोडा है पर तेरे को नाम लेने मे फट रही है ईसाई कसाई की ओलाद तेरा हाथ होगा ऊसमे तु हिदु बिरोदी है,HOF,HATE,TIN,0
2730,3295,3295,hasoc_hi_6503,"तब तो ये #नीच बोल रहा था कि इसकी #हिंदी कमजोर है और #नीच_आदमी से उसका 'वो' मतलब नहीं था !!    @INCIndia जल्दी मरो, इस कव्वे को खीर खिलानी है तेरे श्राद्ध की ..    #AayegaTohModiHi",HOF,OFFN,TIN,1
1104,897,897,hasoc_hi_4419,बांग्लादेश को हराकर वर्ल्डकप के सेमीफाइनल में पहुंचा भारत   #CWC19 #ATCard #INDvBAN,NOT,NONE,NONE,2
4186,2214,2214,hasoc_hi_3959,असली देसी हिन्दी इंडियन चुदाई भाग 4 ,HOF,PRFN,TIN,1
2689,4644,4644,hasoc_hi_7422,देश का तिरंगा नीचे ।  भगवा झंडा तिरंगे से ऊपर ।    इस तस्वीर को देख कर आप खुद इनकी मानसिकता का अंदाज़ा लगा सकते है ।  @AbbasAliRushdi @kanhaiyakumar @AshrafFem @juhiesingh @LambaAlka,HOF,HATE,TIN,0
4173,1996,1996,hasoc_hi_807,"जिन पत्रकारो ने सत्ता की गुलामी के लिए अपना ज़मीर बेच दिया है,   वो अपने बच्चों से कैसे आंख मिलाकर बात करते होंगे ?",HOF,HATE,TIN,0
1741,952,952,hasoc_hi_1390,"गाये का मांस निर्यात करने वालों के नाम पते अखबार में छापे जाये , पता लगे लोगों को असली गुनाहगार कौन हैं ?",NOT,NONE,NONE,2
1311,2707,2707,hasoc_hi_2765,एक भी वादा पूरा नहीं किया इस #कमीने ने     लगता है दमे का रोग लग गया 56' के सीने में!  ,HOF,HATE,UNT,0
911,3303,3303,hasoc_hi_3553,'ॐ'  एक छोटी सी #बच्ची गली में 4-5 #कुत्तों को   देखकर डर गई   कुत्ते बोले निकल जाओ #बेटी हम #कुत्ते हैं   #सुवर नही  #जय_सीताराम ,HOF,HATE,TIN,0
1032,3589,3589,hasoc_hi_6218,300 किलो RDX कहां से आए इसका पता आज तक नही चला??    AN-32 विमान का मलबा 8 दिनों से अपने देश मे नही खोज पाए??    बेटी पढ़ाओ-बेटी बचाओ का नारा देकर उन्हें आज़ाद नही रख पाए??    गुंडे-बदमाशो पे 3 सालो से योगी जी काबू में नही कर पाए?    और चुनाव में कहते थे देश सुरक्षित हाथो में है।,HOF,HATE,TIN,0
2777,3411,3411,hasoc_hi_4244,अरे sir जी 2-5 लाख भी बहुत ज़्यादा है एक कमरे की रेनोवेशन के लिए। फर्श पे इटालियन मार्बल लगा रहा है क्या। केजरीवाल जैसा हरामी और corrupt कोई नहीं।  इसने तो corruption में सबको पीछे छोड़ दिया।,HOF,OFFN,TIN,1
3737,2136,2136,hasoc_hi_1983,#कभी_कभी_मासूम दिखने वाले लोग अंदर से बहुत #कमीने निकलते हैं   ,HOF,OFFN,TIN,1
2617,1637,1637,hasoc_hi_82,लोकसभा में तो #प्रज्ञा_ठाकुर है ही। ये मोहतरमा तो राज्यसभा की तैयारी में है।  @narendramodi @BJP4India,NOT,NONE,NONE,2
3746,2898,2898,hasoc_hi_1216,"पहले तो #भारत के मुसलमानों को तय करना होगा कि वो संविधान के मुताबिक कर्त्तव्य भी निभायेंगे या फिर सिर्फ अपने अधिकार चाहेंगे।  #समझा_करो_यार कि @AbdullahAzamMLA जैसे मुस्लिमों को शरीयत कानून चाहिए था उन्हें #पाकिस्तान खैरात में दे दिया है,और अब यहां सिर्फ संविधान बोलेगा।  #ठीक_है",HOF,HATE,TIN,0
538,19,19,hasoc_hi_918,डॉक्टर की लिखी   7 दिन की दवा के बजाय 3 दिन की दवा ही लेना..   एक आम भारतीय गुण है.. ,NOT,NONE,NONE,2
1958,2817,2817,hasoc_hi_6368,"मुंबई में पिछले 24 घंटे में 26 की मौत, 44 साल में सबसे ज्यादा बारिश..  लापरवाह सिस्टम ने मुंबई को 'डुबा' दिया?  देशहित @ZeeNews 8.30 PM",NOT,NONE,NONE,2
3543,1107,1107,hasoc_hi_4851,यूपी की खबर कानून व्यवस्था को लेकर हमला बोलो और धरना प्रशासन जिला मुख्यालय पर हर ब्लॉक पर अपने विधायकों से लेकर धरना देने का काम करें,NOT,NONE,NONE,2
2914,526,526,hasoc_hi_2461," “मनुष्य कहाँ है?” हिन्दू हैं, मुसलमान हैं, ईसाई हैं, ब्राह्मण हैं, क्षत्रिय हैं, वैश्य हैं, शूद्र हैं, या जातियों में बटने वाले आज मनुष्य कँहा है..?बंगाली, पंजाबी, गुजराती, महाराष्ट्री, कर्नाटकी आदि सैकड़ों हैं पर मनुष्य कहाँ हैं?  @ashokshandilya @aanjaneydas @ManjuChattarjee",NOT,NONE,NONE,2
2811,3488,3488,hasoc_hi_1972,"न जाने कितने ख्वाब दिखाए गए UP आम जनता को भी और मासूम भक्तो को भी?    मंदिर वही बनाएंगे, लेपटॉप देंगे, हत्या-बलात्कार गुंडागर्दी को जड़ से खत्म करेंगे राम राज्य लाएंगे?    UP के CM योगी जी प्रचार के चक्कर में लूट 20%, रेप 41% जैसे विकास कर चुके है।    जो किसी रावण राज में ही संभव है।",NOT,NONE,NONE,2
863,4412,4412,hasoc_hi_1754,गोदी मीडिया आतंकवादी बोलने में तेरी गांड क्यों फट रही,HOF,PRFN,TIN,1
1222,3667,3667,hasoc_hi_5232,#कमीने मोलाना अरशद कासमी को 14 दिन की न्यायिक हिरासत में जेल भेजा गया!!    #कल इसने SC की महिला वकील के साथ LIVE बहस में गाली- गलौज व मारपीट की थी!!    #भारतीय न्याय-व्यवस्था की जय हो??,HOF,HATE,UNT,0
3102,1355,1355,hasoc_hi_7261,ऊपर विडीओ देखा तुमने भोसडीके यहां अंधभक्त वाली कौन सी बात आ गयी,HOF,PRFN,UNT,1
3445,774,774,hasoc_hi_622,"जिंदा रहना है तो हालात से डरना कैसा,  जंग लाज़िम हो तो लश्कर नहीं देखे जाते !!     अतीक अहमद, निर्दलीय प्रत्याशी #वाराणसी",NOT,NONE,NONE,2
1196,4597,4597,hasoc_hi_5752,"तुम सूअर की तरह हमेशा गू ही खाओगे और अपने हाथों एवं मुंह से हमेशा गू ही करोगे क्योंकि तुम्हारी यही आदत है, पहले मंदिर तोड़ देना और फिर जब अपने गान फटने लगे तो शांति का चोला पहनना पुरानी आदत है जिसमें तुम्हारे जैसे लोग सॉरी सूअर अपना पूरा सहयोग करते हैं मकसद तो जिहाद ही है। ",HOF,HATE,TIN,0
3516,3215,3215,hasoc_hi_4905,’اے اﷲ! تو نے میری روح پیدا فرمائی اور تو ہی اسے فوت کرے گا، تیرے ہی لیے (تیرے ہی قبضے میں) اس کی موت اور حیات ہے اگر تو اسے زندہ رکھے تو اس کی حفاظت فرمانا اور اگر تو اسے موت دے تو اسے معاف فرمانا۔ اے اﷲ! بلاشبہ میں تجھ سے عافیت کا سوال کرتا ہوں۔‘‘,HOF,OFFN,UNT,1
2369,1048,1048,hasoc_hi_3817,भेनचोद उसी दिन पूछना था bsdk cag sc ने तौ clean cheat दे दी थी उस पर यकीन नहि था suwar,HOF,PRFN,TIN,1
3902,4217,4217,hasoc_hi_7268,अबे भाई मुझे समझ में नहीं आता @narendramodi और @BJP4India को हम लो क्यूँ जिताये थे.........ताकि इन सुअर की औलादों की माँ ******** जाए लेकिन ये लोग तो भी वही निकले.........चूड़ी वाले,HOF,PRFN,TIN,1
2512,858,858,hasoc_hi_4195,कश्मीरी जायरा वसीम ने अल्लाह के नाम पर फिल्मों में काम करना छोड दिया  जबकि उसी अल्लाह का नाम लेकर कश्मीरी पत्थरबाज हम पर पत्थर फेंकते हैं हमे गालियॉ देते है  हम पर गोलियॉ चलाते है और हमारी गोलियॉ से आंतकवादियों को बचकर भागने में मदद करते है    तुम्हारा अल्लाह दोगला है या तुम मुसलमान?,HOF,HATE,TIN,0
2052,640,640,hasoc_hi_5604,इंशिता आजाद ने नीट की परीक्षा में आँल इंडिया स्तर पर 187 वां Sc कैटगरी मे देशभर में तीसरा रैंक हासिल किया जब कि नीट में 720 में 673 अंक हासिल किया आरक्षण के विरोधियों मुँहतोङ जवाब दिया बहुजन बहन मेरी ओर से ढेरों शुभकामनाऐ !!  #जय_भीम_नमो_बुद्धयेजी,NOT,NONE,NONE,2
3671,3899,3899,hasoc_hi_4239,@NitaBhabhi आपका जिस्म निचोडने का मोका तो दो..DM मे एक रिप्लाय देदो फिर देखो लुंड और चुत की टक्कर surgical strike कर देंगे चुत पर,HOF,PRFN,TIN,1
1147,576,576,hasoc_hi_7136,अंजना जिस तरह से डॉक्‍टर को धमका रहीं थीं और जिस निरहभाव से डॉक्‍टर इस बेहया मोहतरमा को अपनी विवशता समझाने की कोशिश कर रह था।    वह मुुझसे तो देखा ही नहीं जा रहा था। बेड पर बच्‍चे तड़प रहे हैं।     इससे निम्‍नस्‍तर इन लोगों को हो नहीं सकता। ये दया के पात्र हैं।    #AnjanaOmKashyap,NOT,NONE,NONE,2
528,2110,2110,hasoc_hi_5660,जिस दिन  भारत में हिन्दू मास बीफ नहीं खाते हैँ  उस दिन मूल्य price  30% डाउन down हो जाता है  फ़िरभी हिंदू अपने आपको शाकाहारी बोलते हैँ  भारत में बीफ मास के 4सब से बड़े व्यपारी  हिन्दू हैं !,HOF,HATE,TIN,0
1656,1350,1350,hasoc_hi_1318,You better go to class and improve your English first!  भोसडीके! ,HOF,PRFN,UNT,1
3567,938,938,hasoc_hi_4798,इंग्लैंड के खिलाफ भारतीय टीम की जीत की उम्मीदें तभी तक थीं जब तक विराट कोहली क्रीज पर थे. विराट एक बार फिर अर्धशतक को शतक में तब्दील करने से चूके.   पढ़िए वरिष्ठ खेल पत्रकार @Shivendrak का ब्लॉग  @BCCI @englandcricket @imVkohli   https://abpnews.abplive.in/blog/world-cup-2019-why-virat-kohli-can-not-convert-his-half-century-into-century …,NOT,NONE,NONE,2
845,2951,2951,hasoc_hi_1567,इस्लामिक जेहादन कभी अपने नाजायज पत्थरबाज खसमो के बारे में भी बोल दिया कर ।  कि उन इस्लामिक सुअरों को कैसे सुधारा जाए ।,HOF,PRFN,TIN,1
3416,4593,4593,hasoc_hi_1494, नाक टेढ़वा का चले तो देश को सीरिया बना दे मौलाना अखिलेसुद्दीन सिद्दीकी,HOF,HATE,TIN,0
1279,4190,4190,hasoc_hi_6655,साईकिल को #हथिनी ने ऐसा कुचला कि #बबुवा का साईकिल बन गया #धोबी  का #कुत्ता   जो घर का रहा ना घाट का   ईसे कहते है #कुत्ते +#बिल्ली की बेमेल #शादि,HOF,OFFN,UNT,1
682,3292,3292,hasoc_hi_7535,Live : महाराष्ट्र सरकार ने आज 3 जिलों में छुट्टी घोषित की     #MumbaiRainsLiveUpdates #MumbaiRainlive #MumbaiRain      https://zeenews.india.com/hindi/live-tv ,NOT,NONE,NONE,2
3704,3571,3571,hasoc_hi_2131,"अनपढ़ मेरे #गाँव का,  #गाय चराबन जाए।  पढ़ा-लिखा तेरे #शहर का,   #कुत्ते को टहलाये। https://www.facebook.com/100007689400737/posts/2282392165360408/ …",HOF,HATE,UNT,0
2823,458,458,hasoc_hi_2396,"जब #प्रज्ञा_ठाकुर जैसी... सांसद बन सकती है,  तो राम रहीम पे चर्चा करना व्यर्थ है। सरकार है इक्छा उसकी।    हमारे हिसाब से राम रहीम को ठंडा बेडी लगा कर त्रित्तिया खंड में डाल देंना चाहिए।",HOF,HATE,TIN,0
1377,1178,1178,hasoc_hi_2547,पाकिस्तान चुनाव में सिर्फ  लाहौर में 1000 ताबूत तैयार किये  मतलब लाहौर में हजार लोग मरेंगे इसकी पूर्व तैयारी कर ली है  और कुछ काँग्रेशि कहते है पाकिस्तान में भारत से अच्छा लोकतंत्र है #कमीने,HOF,HATE,TIN,0
1221,1244,1244,hasoc_hi_4657,पर तेरी गांड कोई नही मारेगा मीठे। तू कुड़ासा ही मरेगा खस्सी।,HOF,PRFN,TIN,1
210,3196,3196,hasoc_hi_822,"न्यूजीलैंड के 350 ईसाईयो ने उसी मस्जिद मे क़बूला इस्लाम- मेरे अल्लाह की कुदरत देखो जहां मुसलमानो का खून बहता है, वहीं इस्लाम को रौशन कर देता है।",HOF,HATE,TIN,0
