,Unnamed: 0,Unnamed: 0.1,text_id,text,task_1,task_2,task_3,label
713,184,184,hasoc_hi_2378,विश्वसमुदाय पुरस्कार दे रहा है  यहां #कमीने 'गालियाँ'  जिनती गालियाँ दोगे   उतने ही पुरस्कार बढेगे  और हां   यह मत कहना पुरस्कार'हैक'करके लाये है ,NOT,NONE,NONE,2
3300,3629,3629,hasoc_hi_4977,BJP के नेता और PM सिर्फ़ अच्छे से बोलते है जहां चुनाव हो या जहां BJP सरकार न हो?    कैलाश विजयवर्गीय को मीडिया बहुत ही सभ्य बता रही थी बंगाल में शांति लाने वाले नेता बताये जा रहे थे।    लेक़िन कल कैसे के पुत्र ने कर्मचारी को पेला और बाप ने कैसे मीडिया को उसकी औकात दिखा दी।,HOF,HATE,UNT,0
3005,2084,2084,hasoc_hi_6797,एका माणसाने दुसऱ्याला #नीच म्हटले तर त्यात चुकीचे काय आहे...    #NeechAadmi,NOT,NONE,NONE,2
281,3426,3426,hasoc_hi_3414,"#TempleTerrorAttack #TempleDestroyed #ChandniChowk कौन कहता है के इस देश में मुसलमान डर के साये में है, वेस्ट बंगाल और दिल्ली में जा कर देख लो जहाँ आपको कश्मीर का अलगाववाद, आतंकवाद, पत्थरबाज, कठमुल्लावाद, इस्लामीकरण और देशद्रोहिता सब नज़र आ जायेगी...",HOF,HATE,TIN,0
3140,4037,4037,hasoc_hi_5021,"F Abdullah: If Art 370 is temporary then our accession is also temporary, when Maharaja acceded, it was temporary.Was said at that time that a plebiscite will happen & ppl will decide whether to go with India or Pakistan, so if that didn't happen,then how can they remove Art 370?",HOF,OFFN,UNT,1
1120,2379,2379,hasoc_hi_7615,"यह सुधरेगी नहीं कभी कश्मीर पे कभी महाराष्ट्र पे ,पैसे कमाने का यह #नीच ख्याल  अच्छा है ग़ालिब I इस पायल की दुकान बंद करवा दो तब अक्ल आएगी",NOT,NONE,NONE,2
1360,785,785,hasoc_hi_4391,चल आजा  मादरचोद मैं देखता हूं  तेरी चूत में कितना पानी भरा है..!,HOF,PRFN,UNT,1
3642,711,711,hasoc_hi_7534,मुश्किल में फंसे अनिल अंबानी को महाराष्ट्र सरकार ने दी राहत    कंपनी को मिला 7000 करोड़ रु का ऑर्डर  और BSNL-ONGC -JET को फूटी कौड़ी  #NewIndia,NOT,NONE,NONE,2
3146,3329,3329,hasoc_hi_4028,महाराष्ट्र के वर्धा मे 8 साल का दलित बच्चा मंदिर में खेलने गया तो उस बच्चे की पैंट उतारकर धूप से गरम हो चुकी टाइल्स पर बिठा दिया गया. इसके बाद उसकी जमकर पिटाई की गई. टाइल्स इतना गरम था कि बच्चे की कमर के नीचे का हिस्सा जल गया. पूरा स्कीन वहां से हट गया,HOF,HATE,UNT,0
4143,667,667,hasoc_hi_1061,Aap ke sarkar the to aaye din comment karate the ab enako kanun vyavastha dikhaye nahe de rahe dhritrastra hain dum dabakar rajya bhavan me baithe hain.,NOT,NONE,NONE,2
884,605,605,hasoc_hi_902,आपके इंतज़ार का दर्द तो हम चुपचाप सहते हैं;  क्योंकि आप ही हो जो हर पल हमारे दिल में रहते हो;  ना जाने हमें नींद आएगी भी या नहीं;  मगर आप ठीक से सो सको इसलिए आपको शुभ रात्रि कहते हैं।  शुभ रात्रि!   ,NOT,NONE,NONE,2
2547,1443,1443,hasoc_hi_5869,मेरी आंटी की चुदाई 3 s ,HOF,PRFN,TIN,1
2788,1230,1230,hasoc_hi_4415,"रुख बदल दूँगा इन हवाओं के,   शर्त ये है कि साथ निभाते रहिए !!   जब भी लडूं आपके हक के लिए,   बस आप आवाज से आवाज मिलाते रहिए  मिशन   #GoBackModi   #बीजेपी_भगाओ_देश_बचाओ  @AbbasAliRushdi @dralvirashah @yasarshah_SP @maheshwar_sp",NOT,NONE,NONE,2
686,152,152,hasoc_hi_2276,Wtf we lost the review bkz of that prick umpire who can't even see it was pad first. Chutiya umpiring so far this #CWc19,HOF,PRFN,UNT,1
1876,4028,4028,hasoc_hi_7433,"साली हरामी तो तुम लोग हो जो जिस थाली में खाते हो उसी में छेद करते हो. रही बात तेरे लल्लाह  के डर की तो  ऐसा डर तुम ज़ाहिल अनपढ़ों में ही होता है.हमारे में नहीं.तुझे और तेरे लल्लाह को ल.... पर बिठाते  हैं.जयपुर राजस्थान का हूँ समझ रही है न, कभी आमने सामने आ औकात बता देंगे.",HOF,HATE,UNT,0
4047,3634,3634,hasoc_hi_4031,सड़क छाप भक्तो आ रहे है तुम्हारे पप्पा  स्वागत नही करोगे....    घर पर सजा धजा के रखो सब का नम्बर आएगा बारी बारी.... ,HOF,HATE,UNT,0
1690,2672,2672,hasoc_hi_94,"#PAKvsAFG : पाकिस्तान और अफगानिस्तान के बीच जारी था कड़ा मुकाबला, इसी बीच भिड़े दोनों के समर्थक    https://abpnews.abplive.in/sports/world-cup-2019-fans-scuffle-outside-stadium-during-pakistan-afghanistan-match-1157192 …",NOT,NONE,NONE,2
3553,284,284,hasoc_hi_2878,देश में आप के सहयोग से गठबंधन सरकार बनने जा रही है। लोकतंत्र और संविधान को बचाने के लिए देश की जनता की तरफ से मा0 राष्ट्रीय अध्यक्ष जी सपा को अग्रिम बधाई।,NOT,NONE,NONE,2
635,1117,1117,hasoc_hi_2507,"#CWC19 गौतम गंभीर बोले, 'कार्तिक और पंत ने की होती धोनी जैसी बल्लेबाज़ी तो टीम से बाहर होते'  @GautamGambhir @DineshKarthik @RishabPant777 @msdhoni https://www.wahcricket.com/news/wc-2019-gautam-gambhir-says-if-pant-and-karthik-batted-like-ms-dhoni-he-can-not-play-next-match-138810 …",HOF,HATE,TIN,0
2435,3396,3396,hasoc_hi_2565,लगता है उसकी रगो में रिफ्यूजी पख्तूनों का खून बह है पठानों की जगह ....?,HOF,HATE,UNT,0
1559,4176,4176,hasoc_hi_1859,"क्या बे गांडू सुअर की औलाद साले भड़वे    अब चुप क्यों रे तू साले कुत्ते    चाँदनीचौक में घटना के दौरान एक 17 वर्ष के बच्चे का   अपरहण कर लिया गया है कटुओ द्वारा,अभी तक उस मासूम का कुछ पता नही चला है।    साले भड़वे यही है इस्लाम,जिसमे आतंक करना सिखाया जाता है",HOF,HATE,TIN,0
3916,1254,1254,hasoc_hi_6109,इनके दो और साथियों को पुलिस पहले ही जेल भेज चुकी है,NOT,NONE,NONE,2
1616,1881,1881,hasoc_hi_5764,"Janab Alhaj Syed Ahmed Pasha Quadri Sahab MLA Yakutpura And Gen.Secretary Aimim, @RiyazEffendi MLC And Corporator's Has Taken Meeting With @GHMCOnline @CommissionrGHMC Along With Ghmc Officers And Water Works Officers @ GHMC Head Office. @asadowaisi",NOT,NONE,NONE,2
1299,2069,2069,hasoc_hi_6720,@BJP4Delhi के कार्यकर्ताओं ने कहीं चूड़ियां तो नहीं पहन ली ??    @TajinderBagga जी इसी बात पर इन्हें एक T Shirt बनाकर दीजिये।    हम यहां दंगा फसाद की बात नहीं कर रहे।    हमें उस एक एक सुअर को जेल की काल कोठरी में सड़ते हुए देखना है।    ये नहीं होता है तो फिर नज़ारा अलग होगा,HOF,HATE,TIN,0
320,3521,3521,hasoc_hi_3576,"“In Gurugram Muslim man told to remove skullcap,chant Jai Shri Ram”.   It is deplorable. Exemplary action needed by Gurugram authorities. We are a secular nation where @Javedakhtarjadu writes “ओ पालन हारे, निर्गुण और न्यारे” & @RakeyshOmMehra gave us d song “अर्ज़ियाँ” in Delhi 6.",HOF,HATE,TIN,0
926,1910,1910,hasoc_hi_2625,क्या होता है मृत्यु के बाद शरीर का श्री कृष्णा का उपदेश। क्या मृत्यु के बाद संबंध समाप्त हो जाता है? रिश्ते नाते का समयचक्र। #भगवद्गीता में #कृष्णा ने जिसे #उच्च #योनियाँ और #नीच #योनियाँ कहा है उसे #कुरान में क्या कहा गया।  #अहमदईसा #कल्किअवतार #Ahmedisa #Krishna @AvatarKrishn,NOT,NONE,NONE,2
3975,2296,2296,hasoc_hi_2509,"रंडी मीडिया,   तुम क्या सोचते हो? हिन्दू मंदिरों में तोड़ फोड़, हिन्दू घरों पर हमले की खबरें नहीं दिखाओगो तो हम हिंदुओं को पता नहीं चलेगा?",HOF,HATE,TIN,0
2913,2781,2781,hasoc_hi_4936,अब तो विराट कोहली से भी बॉल नहीं रुक रही। क्या हो गया रे मादरचोद। #INDvBAN,HOF,PRFN,UNT,1
204,3263,3263,hasoc_hi_3281,हमे मालूम है तुम्हारे पास ख़ूब बहाने है हमे सताने के   हमने भी अब ढूंढ लिए है रास्ते तुम्हारे करीब आने के    नईम   #बज़्म #हिंदी_शब्द  @10398108Ritesh @SalehaIqbal6  @Aayatkhan_ @Shaheen31304594  @Abdal__Abdullah @Khushi_eik_Pal   @danish_irfana @queen_hoon11  @Mansi94893004 @Azzuwrites,NOT,NONE,NONE,2
1401,420,420,hasoc_hi_2190,"सदर @hasanfaizulkhan पर हमला, मलखान में भर्ती   अल्लाह पाक जल्द सिफा अताह फ़रमाये।। हमारे भाई फैज़ुल हसन को",NOT,NONE,NONE,2
799,4408,4408,hasoc_hi_425,इस सूअर को जल्दी हूरों के पास भेज दो,HOF,HATE,TIN,0
291,3519,3519,hasoc_hi_4629,Kaha tha beta tumhe sirf puri khane milegi...seats nhi...tumhare vagah dimple bhabhi bhi haar gyi,HOF,HATE,TIN,0
3394,4492,4492,hasoc_hi_126,भड़वा है बहनों बेटियों की कमाई खाने को जायज ठहरा रहा है,HOF,PRFN,UNT,1
2164,1053,1053,hasoc_hi_7754,हंस मत भोसडीके... अपनी अपनी परंपरा है,HOF,PRFN,TIN,1
2227,3109,3109,hasoc_hi_4691,चांदनी चौक बना जम्मू कश्मीर  चांदनी चौक में पत्थरबाजों की पत्थरबाजी   #चांदनी चौक  #दिल्ली  #पत्थरबाज,HOF,HATE,TIN,0
696,3160,3160,hasoc_hi_7550,"हरामी कुत्ते , मन्दिर पर हमला करने वालो को गिरफ्तार कर सूअर की ओलाद",HOF,OFFN,TIN,1
472,1666,1666,hasoc_hi_6385,अत्यंत दुःखद एवं अफसोस जनक भैया    परिस्थितियां कैसी भी हो हम समाजवादी संघर्ष करेंगेअत्यंत दुःखद एवं अफसोस जनक भैयापरिस्थितियां कैसी भी हो हम समाजवादी संघर्ष करेंगे…,NOT,NONE,NONE,2
2221,369,369,hasoc_hi_6800,घाटी में पनपते आतंकवादी  सेना पर पत्थर फेंकते पत्थरबाज  कश्मीरी पंडित   अमरनाथ यात्रा पर हर बार हमला   धारा 375 और आर्टिकल 35A  हुर्रियत के नेता का आतंकवादियों का साथ देना.....और ना जाने क्या क्या  ,NOT,NONE,NONE,2
3839,1629,1629,hasoc_hi_4440,200 करोड़ रुपये के टैक्स चोरी के एक मामले में टेंपो चालक सुरेश गोहिल के घर छापा मारा गया  (@gopimaniar),NOT,NONE,NONE,2
2400,1339,1339,hasoc_hi_1699,चन्दा इकट्ठा करके मंदिर बनाने के बजाय स्कूल बनाओ और मंदिर में पुजारी रखने के बजाय स्कूल में अध्यापक रखो ! देश विश्व गुरु बन जाएगा,NOT,NONE,NONE,2
2630,1327,1327,hasoc_hi_6214,21 मई को होने वाली 22 प्रधानमंत्रियों की बैठक टली!    अब 23 मई के परिणाम के बाद विचार करेंगे की बैठक 24 को होगी या 2024 में...!21 मई को होने वाली 22 प्रधानमंत्रियों की बैठक टली!अब 23 मई के परिणाम के बाद विचार करेंगे की बैठक 24 को होगी या 2024 में...!…,NOT,NONE,NONE,2
2924,1709,1709,hasoc_hi_2778,4 बीवी 44 बच्चे  सूअर सबसे जायदा इलाज कराएँगे,HOF,OFFN,UNT,1
2370,1960,1960,hasoc_hi_261,@ghulamnazad : कांग्रेस ने अपने शासन में सबको आज़ादी दी.सही है भिड़ु ये मोदीकी माँ का ...भेनचोद एक लौंडी  से मन भर जाय तो तलाक बोल के दूसरी शादी  सकते थे. आज़ादी से पकिस्तान ज़िंदाबाद बोल सकते थे.अगर तेरी बेटी या बहन होती तो उसे वापर के तीन तलाक दे शकते थे.,HOF,PRFN,TIN,1
1353,3782,3782,hasoc_hi_6645,"भारताला नाही तर संपूर्ण देशाला अहिंसेचा मार्ग स्वीकारायला लावणाऱ्या महापुरुष महात्मा गांधींच्या मारेकऱ्याला #देशभक्त म्हणून #प्रज्ञा_ठाकूर यांनी पूर्ण देशातील जनतेचा अपमान केला आहे, तसेच भाजपाचा तिला पाठिंबा आहे, हे देशातील जनतेत फुट पाडण्याचे लक्षण आहे...  #म #महात्मा #मराठी",HOF,HATE,TIN,0
3058,1704,1704,hasoc_hi_5182,युवा दिलो की धड़कन व प्रेरणादायक देश के सबसे लोकप्रिय नेता समाजवादी पार्टी के राष्ट्रीय अध्यक्ष और उत्तर प्रदेश के पूर्व मुख्यमंत्री @yadavakhilesh जी को जन्मदिन की हार्दिक शुभकामनाएंँ |,NOT,NONE,NONE,2
2837,2821,2821,hasoc_hi_6011,"अबे सूअर की औलाद बुखारी, साले हलाला की पैदाइश,अब अगर तूने कोई कुत्ता गिरी की तो देश का हिन्दू तुझे घर में घुस कर मारेगा । और तेरे समर्थक हिजड़े नेता भी तुझे बचा नहीं पायेंगे । साले नीच कटुए ।",HOF,PRFN,UNT,1
2663,4411,4411,hasoc_hi_2423,अगर इतना ही बदलाव लाना था तो फिर आपने गंदगी फैलाई क्यों?  वादे तो करते हैं लेकिन कोई वादा पूरा नहीं करते. @syedasimwaqar #AIMIM on #HTP क्या मदरसों में सुधार कर PM मोदी मुसलमानों का भरोसा जीत पाएँगे? #मुसलमानों_के_मोदी @nehapant19 at @News18India   @asadowaisi,NOT,NONE,NONE,2
168,3077,3077,hasoc_hi_1226,KAHASUNI: बिहार में बच्चोें की मौत पर प्रधानमंत्री नरेंद्र मोदी की ख़ामोशी. आपकी राय?     #Muzaffarpur #Bihar #ShikharDhawan,HOF,HATE,TIN,0
2963,3220,3220,hasoc_hi_3873,आतंकवादी कसाव की गोली से शहीद हुए #हेमंत_करकरे “देशद्रोही” और गाँधी जी को गोली मारने वाला आतंकवादी गोडसे “देशभक्त”: आतंकवादी accused #प्रज्ञा_ठाकुर ,HOF,HATE,TIN,0
1141,2678,2678,hasoc_hi_7125,"दिल्ली में 300 मुल्ले रात में मंदिर तोड़ते है,     ओर ये मुल्लो का पिछवाड़ा चाटने वाला #दिल्ली में 300 मुल्ले रात में मंदिर तोड़ते है,     ओर ये मुल्लो का पिछवाड़ा चाटने वाला #केजरीवाल झारखंड के #चोर मुल्ले को 5 लाख देता है भड़वा,",HOF,HATE,TIN,0
480,2757,2757,hasoc_hi_5003,"जो कुछ दिल्ली में हुआ, अगर यही भीड़ जय श्री राम बोलती और हमला किसी मस्जिद पर हुआ होता तो अभी खुद की नज़रो में अपनी जरूरत से ज़्यादा समझदार छवि रखने वाले फेसबुकिया लंपट, खुद को सेक्युलर बताने वाले नारंगी संतरे जैसे दिखने वाले लौंडे रंडी रोना रो रहे होते मा****द, साँप सूंघ गया ?",HOF,PRFN,UNT,1
257,373,373,hasoc_hi_1322,"IN Depth: जायरा वसीम का बॉलीवुड को अलविदा, जानें उनकी जिंदगी और करियर से जुड़ा अब तक का सफरनामा  https://abpnews.abplive.in/bollywood/zaira-wasim-quits-bollywood-know-about-his-career-whole-story-till-leaving-the-acting-1158431 …  #ZairaWaseem #ZairaWasim #ZairaQuitsBollywood",NOT,NONE,NONE,2
134,8,8,hasoc_hi_4674,"Do mahashaktiyan mili hain, charo taraf khusi ki leher hai, khus hone wale khus hi rhe hain aur bhakton ko taklif ho rhi hai, khair honi bhi chahiye.",NOT,NONE,NONE,2
2556,1916,1916,hasoc_hi_595,"भाजपा वाले ख़ूब जानते हैं कोन सा #मुद्दा जनता के मुँह पर कब #चिपकाना है #कर्नाटक चुनाव में जिन्ना”गुजरात”में #नीच,”MP”Cg और”राजस्थान”मे”बजरंगबली”दिल्ली”पंजाब”हरियाणा”के लिए #राजीव गांधी और #सिख दंगे,12मई के बाद कोई और,ये सिर्फ इसलिए ताकी जनता 2014 का #धोषणा पत्र न देख सके",HOF,HATE,TIN,0
1951,3080,3080,hasoc_hi_5284,"लगता है भगवा टीम एक भड़वा टीम को बाहर से ही भगवा देगा, क्या इसे ही इसे कूट नीति  कहते है ।",HOF,PRFN,UNT,1
3303,1240,1240,hasoc_hi_329,"'दंगल' की 'धाकड़' गर्ल ज़ायरा वसीम ने छोड़ी एक्टिंग, कहा- अपने धर्म और ईमान से भटक रही थी    https://abpnews.abplive.in/bollywood/dangal-girl-zaira-wasim-quits-acting-1157307 …    #ZairaWasim",NOT,NONE,NONE,2
980,1238,1238,hasoc_hi_5169,यही बोलेंगे की कुछ करवाई भी करेंगे इन हरामी के ऊपर,HOF,HATE,TIN,0
2764,3032,3032,hasoc_hi_5086,बहिन ने नंगी होकर किया मजेदार गाँड - चुत डांस 13 720p ,HOF,PRFN,TIN,1
2414,2628,2628,hasoc_hi_6664,"#AkashVijayvargiya मामले पर बेहद नाराज PM @narendramodi , कहा- 'ऐसी घटना बर्दाश्त नहीं'",NOT,NONE,NONE,2
2187,662,662,hasoc_hi_1015,भारत को इस साल सितंबर तक राफेल लड़ाकू विमान मिल जाएंगे,NOT,NONE,NONE,2
2605,3724,3724,hasoc_hi_2478,"वोटों की गिनती तो कल शुरू होगी, एग्जिट पोल देख कर evm में गड़बड़ी कैसे हो सकती है भोसडीके ?",HOF,PRFN,UNT,1
2771,3598,3598,hasoc_hi_3430,तो इससे पूछो भारत को स्थायी सदस्य बनने में टांग क्यों अड़ाताहै भड़वा चीनी?,HOF,OFFN,TIN,1
2692,3542,3542,hasoc_hi_7061,हमारा भी कुछ शरारत करने का मन कर रहा है बोलो तो आयें  शरारत करने मैडम ऐसी बेकार की बातें करोगी तो तुम्हें कोई इंसान नहीं पता नहीं क्या क्या बोलेंगे लोग सच बोलने से डरती हो तो जाओ डूब मरो शरारती तत्व बोल रही हो इन सूअरों को अरे इंसान नहीं जल्लाद हैँ सूअर के बच्चे हैँ साले मुल्ले,HOF,HATE,TIN,0
1326,2197,2197,hasoc_hi_113,"जब नाच गाना इस्लाम मे हराम है तो अभी जो बॉलीवुड में सब मुस्लिम नाच रहे हैं,वो सब हरामी हैं क्या?  #जस्ट पूछिंग",HOF,HATE,TIN,0
