,Unnamed: 0,Unnamed: 0.1,text,label
4015,5443,5443,انت كول هوا نحن حرين إنتوا أعداء الله والإنسانية على الأرض,1
1175,1654,1654,سقوط تفاهم معراب بذكرني بسقوط الاتفاق قبل حرب الالغاء شخص مريض ما بيشبع حروب عبثية حتى لو طلعتو رئيس,2
2726,1790,1790,يا معالي الوزير أتمنى أن يحاكم الظالم وإعطاء الحق للمظلوم ولكن تبقى أمنية، لأن ما تبقى لنا في هذا الوطن… ,2
1757,139,139,ستموت بحسرة الخواجه ولن يعطيك شرف التحدث معه وابتزازه ايها الازعر السفيه ضبضب ,1
2639,4624,4624,هيدا حمار لا يقرأ سياسه هذا ينفذ انه بوق و صرماية بشار ,1
2619,4284,4284,طز بهيك إعلام فاشل و فارط,1
3654,340,340,هيك بتزعل عمك السيء نصر الله وعمتكن كلكن شريفة إيران أنت وتميم وأبو صواويخ تحت سيادة إيران وكلكم أل… ,0
4509,244,244,ههههههههههه يا هبيلة مين جاب سيرة تميم وقطر غيركانت بتقول إنو أمير الإرهاب طميم ,0
4443,1380,1380,شاطر بالتقليد بس صبت الهدف وليد بيك منك نستفيد   ,2
2377,2755,2755,انتي وكعب صرمايتي القديمه اطهر من نيعك,1
600,447,447,العوني ما الو رب,0
1032,452,452,عندكم زباله يا رجل اكثر من عدد سكان بيروت ، ولك انتي مبين من شكلك انك زباله نايت كلوب لانك انيق وقذر في نفس الوقت,0
2333,4665,4665,انت ابو التنظير وامه طرطور بمتصرفية لبنان بدولة فارس ,1
2902,5624,5624,كول هوا انت واياه,1
3798,4270,4270,أمة عربية و احدة,2
310,2031,2031,وانا معكم انه هذا الميثاق والنظام الخالي اللي خلا جبران باسيل يوقف توظيف…,2
3531,1352,1352,في نوع هبل بيطلّع الواحد من تيابو,2
645,3565,3565,قصدك البغل جبران باسيل؟؟؟,1
1510,1230,1230,في مثل هذا اليوم وُلِد بغل الوطن منحبك القيادة الحكيمة,1
2736,5518,5518,بدك تعميل رايتينغ للحلقة؟ هاجم جبران باسيل أو إذكر إسمه مياومو الاعلام,2
799,4467,4467,قتلت كمال جنبلاط ونام ابنه وليد في احضان قاتله كما فعل الحريري وغيره وغيره والشعب الذي قتل,2
2141,25,25,الامير طلال حبيب قلبنا وبيمون عأكتر من هيك ,2
733,5087,5087,جوليت چوليت يا بني ادم برأس بهيمة,1
4048,3423,3423,وانت ياحمار لازم كمان تعرف انت ومعلمك الهبيلة انو صرمايت لصغير بي بيت الحريري ابتسوى رقبتكون افهمت ولا برجع بعيد سدو لنيعك ياحقير ,1
1375,3829,3829,مين انت يعني حتى عم تهدد انقبر احترم حالك يا نكرة,1
3219,1404,1404,أداء مهين لوزير الخارجية جبران باسيل,2
849,2977,2977,بس لو بتصلح ضابط سوي ل ضابط سوري يا طنبر الجاهلية يعق ,1
2960,1783,1783,لكل يلي عم بزايدوا على جبران باسيل سنة التزم لبنان بمبادرة السلام العربية التي انطلقت من قمة بيروت ويلي قامت على مبدأ…,2
3099,640,640,سمعوا لهل الشوفة لا والله شوفوا لهل السمعة عاهرة تحاضر بالشرف ,1
12,2618,2618,اضرب والريح تصيح جنبلاط عثمان سعدو جعجع كلهم وصرمايتك سوا ,0
3650,3016,3016,هيدول النازحين شو طينتهن يرجعوا ع بلدهن ولك يرحموا انفسهن ويرحمونا العمى بقلوبهن شي بيجنن,0
1934,5368,5368,جبران باسيل حليف حزب الزباله حلفاء شياطين ايران لبنان المزبله ومصدر المخدرات ومصدر الاٍرهاب,0
3945,1026,1026,فيك تشرحلنا يا سندباد شو قدم الشخسعد للبلد من وقت ما هل هلالو عالساحة السياسية غير إنو كان… ,2
446,4293,4293,كلام شعبوي ينم عن جهل بكيفية عمل شركات الخلوي ما في شركات أخذت أي خدمات من الشركات ,2
1011,2407,2407,ابن كلب كان يردح على الحريات وقت الإخوان بس لما العسكر يقمعوا الحريات عادي,1
543,1032,1032,بعد مقابلة الوزير جبران باسيل على تي في,2
23,2181,2181,خيّ نحنا ما منستاهلك و مش مقدرينك محلك مش بالجاهلية محلك بسوريا ,2
4496,2050,2050,خوش اميديد ,2
3154,4691,4691,هل نديم دندول قطيش اعلامي لبناني كل منشوراته وحلقاته تطبيل لبني سعود لذلك كول هوا,1
225,2034,2034,وصار تكتب شعر يا هتيلة ,1
3426,3355,3355,علوي وصخ,0
838,4909,4909,عثمان فاسد ويحميه زعيم فاسد آن الاوان لمحاسبة الفاسدين ,2
2337,5185,5185,اكبر متخلف عرفتو الدولة اللبنانية انت هيك عم تحرق دين العيش المشترك يا عنصري ولك اني كنت ايد الرئيس,1
3533,5314,5314,واحد من زغرتا بيسوى عشرين واحد قوتجي,0
2243,4151,4151,لا يابقرة هاتريك هذا يقولونه للأعب اللي يسجل ثلاث اهداف روحي عالمطبخ بسرعة قبل لا احد يشوفك,0
448,5347,5347,معك خبر انوا اصغر قطري صباطو بيسوى راس يلي خلفك يا صعلوك روح اندحش بي طيز بشار النعجة تاعك ,1
3819,2578,2578,هول ناسيهن منيح ذكرتو فيهن   ,2
4086,2740,2740,كول خرا انت وممانعتك,1
2772,2331,2331,بلا ما نفوت نقرالك كول هوا عصحة السلامة,1
3003,1537,1537,المحجبة ليست أمية ولا جاهلة صورة عنصرية مقززة لا تمت إلى الروعة بصلة,2
1607,4053,4053,تماماً ولما يشاركوا نفس القناعات بالاخر بيكون الواحد عم يثبت صحة آراءه وبالتالي عم ي حاله,2
1037,1158,1158,اخونجي متصهين,1
4179,955,955,ﺍﻟﺘﻘﻰ ﺍﻟﻮﺯﻳﺮ ﺟﺒﺮﺍﻥ ﺑﺎﺳﻴﻞ ﻓﻲ ﺩﺍﻓﻮﺱ ﺍﻟﻤﺒﻌﻮﺙ ﺍﻟﺨﺎﺹ ﻟﻸﻣﻢ ﺍﻟﻤﺘﺤﺪﺓ ﻓﻲ ﺳﻮﺭﻳﺎ,2
3391,435,435,قولارجي طلع اخو الدياني ,2
875,1902,1902,كب السم على اصوله من سلام الزعتري عالوزير جبران باسيل حول مقابلته مع ال منا وجر,2
1960,5284,5284,روح بعيد ولاك سعودي وهابي كلب يا اهل الاجرام والنجاسة يا يهود خيبر,0
317,4094,4094,هوا عليك و ع بلدك و ع عبودة كمان  ليش اسمكن بلد انتو اصغر قرية بسوريا اكبر من بلدك كلها يا قرباط الشرق الاوسط  لعن الله من جمعكم حثالة حقكم صرماية تنضربو فيها,0
680,4319,4319,هنن هالبهايم اكتر مخلوقات بيستعملوا التكنولوجيا مشان يقنعوا حالهن انهن بشر,1
4119,5809,5809,خراس ولا جاهل حشرة,1
1597,859,859,المشكلة انو دكتاتور حقو فرنك عديم الرؤية و الفهم وعاملي فيها خامس الخلفاء و مو شاطر غير بالهوبرة و الزعبرة و اللعي و رح يجيب اجل تركيا عاجلاً غير آجل و مع ذلك الشبيبة مغرمين فيه؛المصيبة انو الحج اردوغان هو نموذج ثلاثي الأبعاد للمقولة ا,1
3188,2813,2813,كتبت تويت من يومين  توقّعت فيها اتّهام جبران باسيل بسرقة السندات القطرية حطيتها بال قلت مش معقول نوصل لهالدرجة ,2
1378,1499,1499,ديما الرائعة والمتألقة ,2
418,530,530,نسيت انو التيار اسمو التوحيد حتى بالهبل بيتوحدوا اي والحمرنة كمان   ,0
2648,554,554,ما حترمك النوم الا اللواء عثمان والبوط العسكري تاعوا رح يحطوا بي تمك خليك عم تعووي قرب وقت البوط يدوس راسك ,1
2548,4056,4056,مصر طيز الدنيا,0
3651,4394,4394,اذا جرابيع الضاحيه هنن اشرف الناس طز بهيك ناس وطز بشرفهم,0
2380,4630,4630,لا تشتري الجنبلاطي الا والعصا معه انهم لانجاس مناكيد,0
4127,4836,4836,معك حق والله ,2
1070,4087,4087,خدلك نصيحة خدلك نصيحة عنا الحلبية كلون شبيحة,0
2763,1143,1143,بيت الدعارة مطرح منك ساكنة ، الجامع ألوا أحترام,1
1241,5434,5434,استغرب من كلب من كلاب عرب الشمال المهاجرين من قمع اوطانهم يجي يحاضر علينا كالعاهره تحاضر عن الشرف ياعزيزي ليس كل الحكام مثل بشار الحمار,0
1789,1578,1578,يا باريس ، احفظي ما عليكي,2
1216,3148,3148,جبران باسيل وعمه جنرال اسرائيل سابقاً العماد ميشال عون يمثلون سياسة الزباله التي قدمها سيدهم نصراللات لهم على طبقاً من الخياسة,0
1749,2860,2860,شكلك متل شكل ابليس روح طم حالك بشي كبيني العقاب لوهاب وهاب قاتل ابو دياب ,0
3955,2009,2009,طبعا زبالة لمتلك ومتل جبران باسيل,1
2033,1424,1424,هلق انت مين داس ع دنبك,1
94,1215,1215,انت قد عماد عثمان ياصوص ,1
2512,2882,2882,بخصوص موقف جبران باسيل بالنسبة من العداء مع اسرائيل انه ليس خلاف ايديولوجي اين بيانكم من البحث الذي توعدتم به؟,2
858,4180,4180,كلنا معك يا بطل هيدي هيي الرجوله بيضل عموقف واحد مش بيبروم ليحمي حالو ومصالحو اتعلمو من وئام وهاب الشرف ,2
2134,3826,3826,بعدان مينك انت يا نكرة بدون اسم وصورة لما يصير عندك اسم منبقى منحكي روح انقبر,1
2641,3107,3107,نحن نعمل ضد جبران باسيل لانه العدو الاكبر للمسيحيين في لبنان,2
2688,3386,3386,مصطفى حمدان كول هوا طوني خليفة,1
759,354,354,ئوبة كلاب خربوها وقعدوا على تلتها,0
419,1183,1183,شعب فاسد وانتم افسد ,0
2191,4377,4377,طز بهيك وطن وطز باللي بده يرجعله,0
671,4890,4890,يجي يوم وسننتقم من كل كلب لبناني تسبب بأذى للشعب السوري  وسيدفعون الثمن غالي,0
3652,2010,2010,بيلبقلنا رياضة وصرماية اجلكُن,2
1226,3245,3245,مش عيب تكوني حمارة خاصة اذا ميولك قواتجية بس تكوني حمارة و مدعية! يا رب ارحم و اشفي هالطفلة البلوي على اهلها و المجتمع   إلى الرب نصلي,0
675,4549,4549,"عيب يا كلبة لما تجيبي سيرة مصر وتقولي عليها شعب فقير ومشرد يا لبنانيين يا انجاس, فعلا ده انتو شعب كلاب",0
42,4857,4857,خروات معراب وبقايا اذار والحاقدين,0
2561,1236,1236,يازلمه انتو اكبر مخربين انت ونظام الاسد في الفان وسته قلتم شكرا قطر ما عندكم وفاء لا حده ,1
2315,3268,3268,أول حلقة من دون جملة جبران باسيل,2
1487,4850,4850,عاهرات االله يخلصنا منهن يا رب ,1
725,1765,1765,كلكم من فصيلة الكلاب الخونة المرتزقة لا استثني منكم احد لبنان بحاجة لانتفاضة اذا أراد الخلاص من فسادكم وعهركم ,0
2760,5208,5208,كن عزيزاً وإياك أن تنحني مهما كان الأمر ضرورياً فربما لا تأتيك الفرصة كي ترفع رأسك مرة أخرى عمر المختار ,2
730,3349,3349,فيصل الجحش انت درزي كلب وبدك تحكي بالدين الإسلامي لك فشرت يا فيصل الجحش أن تتكلم بأسم الدين الإسلامي,0
691,3761,3761,برغوت قواتجي,0
880,5619,5619,يا حبيبي سعد الحريري باع دم بيو كرمال يعمر سوريا تفه شو واطي رح تروحو تحت الدعس طول بالك انت بدك تحكي رأيس وليد بيك جنبلاط يا وطي,0
305,654,654,لو الكل بيرشق هالسياسيين العرب بالسرامي بكون شي كتير منيح على الاقل بيعرفوا قيمتهم عند الشعوب ,0
3349,1511,1511,عما بقلبك شو سميكة بتحكي ثلاث لغات بالجملة مفكرة حالك كلاس ولا اسخف واجلأ من هيك,1
2796,2605,2605,أنا ما عم بحكي بحقها عم بحكي عن يلي عم بهاجموا جبران باسيل مبارح وبال ,2
3670,1766,1766,مياومو الإعلام اللي شالوا كل مشاكل البلد تيركزوا على جبران باسيل,2
2060,4886,4886,نصاااب كلب لبناني عميل لحزب الشيطان,0
3019,3089,3089,اخت الزمان يللي خلا كلاب المزابل يطلع صوتها لكل الجرادين العونية الالاهية برد و بقللن انو سامي الجميل عندو عنفوان    ,0
4625,5527,5527,هذا يدور قطري مايدري ان امير قطر سلم قطر للتركي الفاسق يعني خليك مشرد ,0
2316,5757,5757,واولهم معلمك جبران باسيل بيو كان يبيع ليموناضة كحيان من وين جاب ثروته عون كان قائد جيش من جاب ثروته بس يرجعو أموال الشعب,2
2525,4032,4032,انت كول خرا يا خرا بس بدك تجيب اسم سليمان بيك بتبخر تمك يا بغل,1
3041,2361,2361,كول هوا وتابع بصمت,1
3815,3273,3273,لا تعلق على الشعب الخرى بطريقة الشعب الخرى,0
126,177,177,مستحيل يكون في اوسخ وانجس منك بالكون يا ديوث ,1
2615,5349,5349,هاد ما بدو خزرة زرقا بدو نعل الجحش,1
2537,5435,5435,جبران باسيل قبل وبعد  ,2
2974,5705,5705,تخيل قديش لبنان زبالة اذا وش السحارة تبعه جيسيكا عازار,0
628,4482,4482,دمشق الماضي ليست دمشق الحاضر يا فهيم ويا ريتك تنقلع وتنقبر تروح لعند الجربوع تبعك يا تابع يا قرقور ,1
3354,369,369,ولنا أيضاً مهارة تجميل الواقع الزبالة، مثلاً صور شوارع دمشق معالجة بالألوان والفلاتر والإضائة بشكل مبالغ فيه، لدرجة لا تحاكي…,2
4591,3569,3569,محاسبة لمشنوق  لعماد عثمان عصفور كفل زرزور والتنين طيارين,2
151,199,199,جبران باسيل لم يقدم هو يأخذ فقط بتحط نفسك بمواقف بايخة  ,2
1907,2304,2304,انت خراس,1
2745,3456,3456,مياوم شخص بيشتغل كل يوم ضد جبران باسيل,2
2755,2367,2367,طيب وهاي عملتي تجميل لوجك وصرتي وحدة جديدة وصاروا ولادك يبكوا بدن إمن شو بتعملي,2
3352,3734,3734,يا فرحة ما تمت,2
2910,2913,2913,لا تحزني يا ميرا هذا زمن الصعاليك ,2
4091,5350,5350,لهلهله يا كلب الأمريكان عم تشتم الاستاذ بسام,1
4133,3081,3081,انتو العونية ضيعان الحكي  معكون  ارطيط كلاب  كيف الله بلى لبنان فيكون,0
347,4872,4872,سورية سنية وستبقى سنية وحسبي الله ونعم الوكيل بالعرب الخونة الذين باعوا الشعب السوري بالرخيص فليفرح ابن زايد وكل كلب عربي دعم بشار الجحش,0
3428,2279,2279,ما حدا باعصك الا اللواء   ,1
4596,60,60,لا كل الثواار كلاب متل النظام هيك جملة سهل قولها وما بتوجع الراس وبتريحك من كتير وجع راس وتفكير الكل كلاب ليش اهتم او ادعم طرف؟,0
512,5113,5113,حذف تغريدته لانه كلب من كلاب الترك شركسي الاصل او يوناني,0
2980,3935,3935,والله يا أخي الكريم أغلب القطريين بلا ذمه ولا أخلاق ولا شرف للأسف,0
4659,236,236,يلّي بدّو يجيب سيرة الوزير جبران باسيل بالعاطل بدّو يسمع كلام أوسخ من أعمال حركة أمل,0
1185,5388,5388,كول هوا صارو  ,1
3545,2825,2825,كذِّب وسلينا ما انت يا بتكذب يا بتْبَعِّق ,1
1596,2554,2554,ذميم جاء مرغما بناء على طلب اسيادة في طهران والضاحية كلب مرسله كلب ومستقبله كلب ,1
242,3433,3433,بدنا نضل ونغير لبقر لمتلك يا خروف خروف ,1
3427,5045,5045,ليك يا اهبل احكي ععدد الشعر يللي براسك يا اقرع النحس عاملكم عقدة اللواء يا طشم,0
1214,5271,5271,"""روح انتحر كب حالك بالبحر اطهر ارض و انجس قوم""",0
3054,1422,1422,كول هوا شقفة عميل و كلب وواطي وحقك فرنكين بسوق الغلا نسيت لما كنت تنام بالقرداحة ناطر بالدور ل…,1
4531,38,38,قليل بحقه الحذاء ,1
331,5397,5397,جبران باسيل هو نفسه لا يتغير في الداخل يعزز الشراكة اللبنانية وفي الخارج يعزز التفاهمات العربية انه مهندس السياسات,2
226,346,346,روح انقبر ضب حالك ,1
611,2346,2346,القزم جبران باسيل طلع له فانز يدافعون عنه,0
609,787,787,شو ضعيف وشو مقهور ومش قادر تعمل شيطز فيكم كلكن كلكن بتصبوا بخانة الكذب والنفاق بتدعسوا عا الناس لمصالحهم وفسادكم ,1
1590,3316,3316,لك النظام السوري انتصر وتاج راسك يا درزي يا خاين سد نيعك عمى اللي يعميك,0
805,4916,4916,هيدا فايك اكونت ما عندو فلورز بس لازمو بهدلي ليك يا حيوان يا ابن الكلب صباط ونعل صباط بيت الحريري براسك يا كلب نبح عامل اكونت مزيف لانك منك رجال ولك تفه عليك يا واطي وهلق فيني قول ارتحت نفسيا,1
1530,1211,1211,وضع جبران باسيل بالواجهة السياسية في القمة العربية أفقد لبنان زوار ومشاركين من رؤساء الى مخاتير,2
1763,2366,2366,كول خرا يا خرا ابن خرا انتا وابو المنشار دب الداشر محدا غيركن دمر وطن العربي الااسلامي يا منافقين ,1
2310,1589,1589,يا مشحرة شو منوب انتي كيف بتضهري لبرا ولك فوتي عن البرندا احسن ما يراشقوكي تعون السترات الصفر بالبيض,1
1522,511,511,تركية قاهرتكم الله يحمي الرئيس اردوغان   ,2
3691,3027,3027,يا عفيف يا شريف يا طاهر لازم ينعملك مكان لنصير ناخد بركاتك واخلاصك يا حرامي المدينة وقاتل محمد ,2
4585,4197,4197,اشم ريحت زباله يمكن سني حقير هنا,0
2210,3210,3210,والله أنت شخص أناني لا يمث بصلة لأبناء لبنان الكرماء كم أعطوك أل سعود لتغرذ بهذه التغريذة ,2
2967,2651,2651,ويا بهيم ليه ما بتسد بوزك,1
2477,58,58,كثروا المنافقين اصحاب المصالح   هاذا اكبر كلب لأيران في لبنان ، تابع هالفديوا وتعرف هالمرتزق … ,1
3631,4088,4088,اذا معلمهم هبيلة بعمرك شفت عوني بيفهم,0
2743,3793,3793,الزعامة والتجربة بدن يكونوا اصحابها رجال مش صيصان خسئت يا جبران باسيل,1
133,101,101,ما هوي لو بياكل سرماية بعيد عنا بقول يعدمني يا فكروا اذا بصرخوا صوتهن بيوصل   ,1
271,4464,4464,هيدا سياسي انتهازي عفن ورخيص لو عنا دولة قوية كان هلق بالسجن ,1
4167,3714,3714,الخراب عندك ومنك يا بوم الخراب ,1
4330,3093,3093,يجب تطهير المجتمع المسيحي من الجرثومة العونيه انهم كلاب الوطن,0
1009,2450,2450,كل زق يا باطني ,0
4030,5026,5026,خليك منتظر ليرجع جبران باسيل الله يرحم ايامك يا ميشيل عون,2
3692,5356,5356,ياخي الولاد الصغار من عمر تلات سنين بدهم حرق خاصة لما يطلعوا معك بباص بقرفوا,0
2031,5038,5038,تضرب منك لحزب اللات عمللء ياطشم,0
3170,2974,2974,أعوذ بالله يمكن اليونايين النور الألمان ما بيعملوها أبداً أعوذ بالله,0
2438,4122,4122,شو وايك تحط صرماية عتيقة بنص حنكك انت كمان ما حدا خائن غير سلالة القرود الاسدية باعو البلد للصهيوني والايراني المجوسي,0
2488,3700,3700,كلام سليم وصحيح ويسعد صباحك يا استاذ وئام ,2
265,1295,1295,وهل يجوز ان تضحي بمرافقك لتمشي مخطط برأسك؟ الذي يقتل نفس له جهنم وبئس المصير ,2
81,4072,4072,جيش ابو شحاطة النصيري القذر الجيش الوحيد بالعالم يلي بيقتل شعبه كي يبقى الخنزير بشار متخوزق عالكرسي اتفووووو,0
1048,1831,1831,طبال بمرتبة طرطور عند ابن انيسه مخلوف ,1
3042,4698,4698,سد بوزك يا كلب انت واحد بلا كرامي واطي,1
328,5454,5454,هل تعلم يا عزيزي المتفاخر بأن الاورثوذوكسية ما زالت حية في فينيقيا بأن الفينيقيين ما كانوا مسيحيين,2
11,2022,2022,الله يحرقهم جميعا ما عدا هل كم واحد الشغالين ع المحطة و بس يخلص المونديال ينحرقوا و تنحرق المحطة و يصبح الجميع سعداء,0
1560,2153,2153,عماد عثمان قاهر ابواق النظام السوري ولما وئام الحمار يحكي ,1
4204,3804,3804,تونس عظيمة,2
516,5262,5262,كلاب حركة أمل فلتانين ع السوريين,0
4428,4133,4133,على اساس ان الاجنبي بيترك الشقر وبيتزوجك يا ام ركبه سودا,0
1079,2841,2841,الى اين يا فصعون السياسة يا جبران باسيل في زمن التبعيه والتعطيل,1
2334,5641,5641,بس حدا يقول مين هو هيدا النذل الطرطور يلي عمل هيك بامو تفه عليه شو واطي إلك يوم يا عاق واللهِ ولادك رح يكبوك كبة أوسخ من هيك وما تلاقي مين يلمك,1
2166,330,330,مي شيدياق ناحسة سما هالحكومة يا جماعة غيروها بركي بيمشي الحال,0
2616,3176,3176,نعم يافلاح  يا ضيعجي ياتافه يا درزي باتحكي عن السوريبن وانت اول من يتمنى موتهم وفنائهم وتبقى طائفتك الدرزية ياحشرة,0
3240,1416,1416,إنتي بالنسبة إلك الثورة زوجة الثور بس هلقد ,2
2789,4320,4320,ما بدا هل قد وقفو الطائفية بيمشي الحال,2
4604,3920,3920,لم يقل جبران باسيل غير ذلك كلامه دبلوماسي,2
3235,2649,2649,زمن الاوغاد ,2
2180,2275,2275,معالي الوزير الخيارين بيظبطوا ,2
2578,1563,1563,يا كلب يا لقيط ما حدا غيرك العاهر ابن عاهرة يا مرتد الله يلعنك ويلعن كل مين ع… ,1
4616,1136,1136,يا وزير الصدفة نحنا مرخينلك الحبل لاءن في عنا بالطايفة ناس عم يستفيدو منك ،،،، بوظيفة او معاش او واحد ف… ,2
3829,2631,2631,انت حمار يا ول ولا بتستحمر علينا,1
2398,3867,3867,انقبر احترم حالك يا واطي واغبى واهبل من العونية ما في,0
1373,5405,5405,لو بتخرس ولا احلالك انقلع شقفة مجنس لاجئ عندنا,0
2800,2266,2266,ليك يا شعبان لا انت ولا الغريب معترف فيكم واذا ميشال عَون ما بيعرف بامور الموحدين ينزلمن موقعواحسن لانو الغلط بيجر الغلط ,2
2686,1429,1429,سعد فرط ,2
4336,2844,2844,بس جبران باسيل عم يخبص كتيير,2
3029,2492,2492,ع اساس بيروت ناطرة اشارة منك لتستقبل امير قطر او غيره ,2
