,Unnamed: 0,Unnamed: 0.1,text,label
4130,269,269,عندما يقال يا شحاذ يظهر لك باسيل جبران,1
3460,1791,1791,و شراميط الاعلام,1
524,3732,3732,العمى شو انكن عبيد,0
27,2177,2177,و انت يا ابو امارات بنفس الزورق معهم ,2
1961,278,278,الروس المفروض ينشهروا بالوقاحة مو بالڤودكا,0
1893,1957,1957,انت واقتراحك وصرماية اللواء عثمان سوا سوا ,1
4116,3568,3568,هاد كان في متلو كتير بحلب بشارع التلل,2
1637,3169,3169,انت عقدة النقص يلي عندك انك فلاح ودون ابن المدبنة لهلاء ملاحقتك حتى لو تعلمت يا فلاح بتضل ضيعجي وبتضل دون,0
3275,1653,1653,بتمنى من اخواننا في الوطن يلي عم يتهموا الوزير جبران باسيل يقرأوا هالتغريدة من صحافي كلنا منعرف توجهه السياسي  ,2
31,221,221,والله الحذاء خساره فيهم ,1
3316,4339,4339,طز بهيك بلد وهيك شعب وهيك حكومة,0
2005,461,461,نرجو ذلك يا معالي النائب ,2
2751,1226,1226,الحرمة بتضل حرمة,0
3487,2293,2293,ولعها ولع ولع وأعطيني شحطة العقاب لوهاب وهاب قاتل ابو دياب ,2
1823,1151,1151,كان هدفها الاسائة للسعودية فقط عبر تلفيق الاكاذيب كعادة هؤلاء الغجر معنا لكن تورطت مع حساب النرويج,0
674,1599,1599,رب يسعد مساك ,2
803,613,613,نتمنى أن لا ينظر علينا أحد بمحاربة الفساد بعد اليوم إذا لم يتم سجن عماد عثمان فالمذكور في جريدة الأخبار يطيح بدولة… ,2
634,425,425,كوووووووول خرااااااا ولاااااك ,1
3421,5720,5720,الرعاع اللي هاجو بسوريا نحنا قرفانين منهم وقلنا عنهم خونة وجلب بوقت اللي كان سعدو وجعجع عاملين مهرجانات ليدعموهم وهربولهم بواخر سلاح,0
3125,972,972,ما حدا غيرك أمير الإرهاب والمجرم السفاح طز بهيك بلد خلف امتالك يا حمار ,0
4433,1560,1560,مش معقول كمية الجهل والغباء والحقد الاعمى بالردود شعب بس بعد ناقصوا الرسن المكاري موجود بس هيك ♂,0
286,5464,5464,ملعون هو وابوه وابو عيلتو وابو اسرائيل على ابو الي بدو يروح ع اسرائيل لعمى اوقح من السوريين المعارضين وانذل واخون انا ماشفت ولاعيني رأت,0
567,2722,2722,اي دموقراطيه عم تحكي عليها انتو النسوان  ماعندكن شي اسمو دموقراطيه عدكن نكد واخواته ,0
3360,2216,2216,والله ربنا ليلعن تعاريص عرضه,1
1916,1405,1405,كول هوا يارعي البقر,1
4453,849,849,لا يزال نِصفُكَ عالِقٌ في الصندوق الأسود فكّر فيا ,2
1254,4431,4431,يلعن ابوكن شبيحة تفو عليكن وعلى الجحش بشار والجحش حسن زميرة,0
25,5084,5084,هو من حزب الحق والعقل يا بهيمه الاخوان,0
2912,1915,1915,مين داعمو ؟؟؟؟ لو سمحت تعطي أسماء يا وءام ,2
2258,3297,3297,جبران باسيل الرجل الذي لا ينام قدن كلن,2
341,5574,5574,اكيد حتى جبران باسيل لا يرضى به,2
1756,4054,4054,لم ترى عيني أعهر من مسيحي لبناني يقف جنباً الى جنب مع حسن نصر الشيطان وجماعته ,0
2279,2767,2767,يا معاليك انت على حق لكن سؤال المليار دولار عا كم شخص توزعت   كل واحد مجرم و ساعد في تدمير سوريه ولي  ,2
405,2498,2498,مت بغيضك ,1
4536,2667,2667,هؤلاء الخبثاء والخنازير أينما حلو يحل بارضهم الخراب     ,0
626,1362,1362,شابك على نت بيتنا و بتحكيلي كول هوا ؟ طيب هياني نازل,1
1430,5601,5601,العمى يعميك شو جحش صحيح انك بلا حياء وما عندك ذرة كرامة يا واطي,1
4655,2541,2541,هههه انت اميد غبي ولا تعرف شيء الاخونجيه منضمه ارهابيه بالمملكه العربيه السعوديه     ,0
745,2018,2018,أسعد الله صباحك أستاذ وئام أنت صاحب المواقف والكلمة الجريئة ونسر الجبل ,2
4024,344,344,التنين نفس الخريه      ,1
2399,4862,4862,ميشال عون عون و صهرو الهبيلة جبران باسيل باسو صرماية تميم كرمال تشتري قطر سندات لبنانية لبنان دولة شحادة رسميا,0
4501,4657,4657,الحريمة بتضل حريمة,0
4557,5698,5698,جبران باسيل يهدد أمن إسرائيل,2
3267,3199,3199,متعود تنشر قذارتك يا فيصل القاسم درزي قذر  ,0
4367,2084,2084,داعم للإرهاب في كل مكان ليس لبنان فقط وحضر لبنان ليس حباً ولكن نكاية في الذين لم يشاركوا ,2
508,3370,3370,بس مين مسيطر على زراعة الحشيش مو كلها بالجنوب,2
3441,104,104,انت صنفتو بخانة الخيانة وهيدا رد على ردك ومش كل الادوية فعالة وان شاء الله الكل بيفتخر بشهادة الحريري,1
454,4963,4963,منيح لالك لانو حضرتك مرفوع عليك دعاوى قدح وذم والقاضي والدولة لهلا ماجابتك حضرتك كنت لح تعمل فتنة بلبنان,2
160,5156,5156,اودع مليار عشان حزب الشيطان بلبنان يمر بمرحله صعبة بعد ما توقف الدعم الايران اثر الحصار عليها,0
2433,2111,2111,معك حق بالنسبة للإنتماء الطائفي في لبنان لكن هذا لا يعني أنه لا يوجد ديمقراط…,2
4284,583,583,مستهبل ومن لف لفيفها بصوت واحد الحق على جبران باسيل   ,1
3194,4760,4760,تركيا أحقر من أن يكون لها مشروع ينفذ ، هو مشروع غربي مسيحي خبيث كخبث دينهم ,0
4624,1386,1386,و الله ما يدرون وين الله قاطهم خونة منافقين,1
2659,1455,1455,الله يسامح الربط الحمار وفلتك ,1
2598,5645,5645,مايقدر يرد ابن درزيه واطي,0
3523,5622,5622,شو بدي قول إذا فيك دم روح فل من لبنان مكانك مش لبنان ياعميل بشار عفوا كلب بشار ,1
1947,3690,3690,انت عن جد قابض حالك جد ومفكر حالك متفهم بالسياسة واحد ماءجور وبتحكي مثل ما معلمينك بقلولك هبيلة,1
4522,310,310,فلوس قطر مهمتها السيطره على الحيوانات والبهايم وفي الاخير يشتغلو في القواده هذه نهاية كل شخص يدخل او يهتم بقطر ,0
2296,353,353,يا استاذ وئام اتحدث معك من السويداء ونحن نقف معك ونشد من ازرك ولكن يبدو ان الشيطان الاكبر يقبع بالمختارة ,1
2381,4219,4219,أقترح ردم اللاجئين بالبحر على طريقة ردم جبل النفايات بصيدا,0
3836,5811,5811,يزلمه موهاديلي طلع على الضيعه لعندك ومجهذ بجيش لعتقالك ,2
526,1033,1033,اكيد كلهم عاهرات وفاسدين ,0
657,4420,4420,استاذ وئام انت رجل كبير ولك تقديرك ما نحب ان نجرحك بكلمة بس سيدي لي سؤال ايش حشرك في دول أخرى ,2
1088,829,829,الرئيس ميشال عون الرئيس العربي الأصيل,2
1592,5474,5474,صدقت وأنت كذوب ,1
1213,2899,2899,الملاحدة بقر ياخي,0
977,5635,5635,الاستاذ وئام وهاب من ارقى الساسة بالشرق الاوسط صريح شجاع مهني شريف وطني تحياتنا من العراق الجريح ,2
288,3833,3833,المهم نحنا فينيقيين مش عرب واللاجئين السوريين ما بيشبهونا,0
3347,4567,4567,والتصدي للقوى الأمنية وشهر السلاح في وجهها وتحدي القضاء وأطلاق النار في الجاهلية بشكل عشوائي لترهيب,2
4519,545,545,يا زلمي انت عندك مشكلة لازم تحلها او انو الانكليزي صعب عليك,2
899,5372,5372,العرب كلهم بدهم حرق وبس,0
658,3317,3317,فيصل القاسم أنت درزي وفتان والآن بدأت الفتنة على الأردن سد بوزك واسكت,0
3967,5732,5732,لقد رفعت معنويات أكثرية الشعب اللبناني وإذا مش كل الشعب ،في ناس من داخلها بتتشكرك ممكن ما بتقدر تقولها,2
3681,5257,5257,مؤمنون بلا حدود طلعت بالآخر ليتها الحدود,2
1281,5708,5708,والله جبتي البهدلة ل الك لانك بتستاهليها انتو ما بيلبقلكن متل الشيخ سعد يحترمكن وما يرد,2
1679,229,229,قديش صرت كاتب سمعت شي مرة البيك تطلع عليك او رد يا مفتن الطايفة يا ابن شعبان؟ الله لا يوفقك كما قالوا… ,0
2490,4252,4252,اخرس ولا حقير لما وقف وليد جنبلاط ضد النظام السوري عام 2005 كنت حضرتك كلب عند بشار الأسد فسد بوزك ولا تتذاكى,1
1588,756,756,يا اخي قلنالك نقول نفوسك على سوريا بتوفر بنزين طالع نازل على الطريق وبتوفر تليفونات وفاكسات الله يباركل… ,2
4129,2639,2639,اذا قالتلك أولاً مش طايقتك   شو إلو لزوم تانيا,2
2535,4762,4762,تفوووو عليك واحد حقير بدك تخرب الأردن متل ما خربت سوريا انتو شعب حقير حقير الملك خط أحمر يا غبي,0
2746,3796,3796,جبران باسيل ❤ ❤ ❤ ❤ ❤ ❤ بس هيك نكاية بقلب لي مش عاجبو  ,2
2961,4139,4139,ممكن تخبرنا مين هني ثلاثة ابطال ,2
2062,5385,5385,والله ماحدا حمار غير الشعب اللبناني الأخ طالعو يخت وعامل فيها مدير,0
234,4693,4693,معراب خانت لبنان معراب الخائنة معراب السفاهة معراب التقلب معراب الدم معراب العمالة معراب الشر معراب الوكر معراب العداء,0
732,2321,2321,اسمع يا هذا اسمه فضيلة الشيخ أسامة شهاب لازم تعرف كيف تحترم الناس حتى الناس تحترمك بكفيك شنهقة ,1
4228,4991,4991,اثار وصف وزير الخارجية والمغتربين في حكومة تصريف الاعمال جبران باسيل زيارة الأمير القطري «بخرق الحصار» حفيظة دول,2
3105,4387,4387,هل تعلم يا عزيزي ان اي شخص يستعمل كلمة فينيقيا للدلالة على لبنان هو حمار معبا ببنطلون,1
1906,5342,5342,وقصر ابن الحرام,1
4213,3595,3595, خراس يا حشرة,1
4351,2507,2507,خروات معراب وبقايا اذار والحاقدين ,0
3233,5775,5775,انت اول منحطة ,1
1712,3887,3887,هاهاها للأسف كان عنا حرب ودول حاكمتنا متل سوريا والسعودية وإسرائيل وغيرن أنا بقول جبران,2
2426,1510,1510,صدقتي ديما لكن للاسف اللبنانيين من اكثر تخلفا وعنصريه,0
2047,5228,5228,اين مهنيتك يا أصلع يا عبد المال شكرا لحقدك المدفون تفه على مارسال غانم,0
1427,4155,4155,فخر يلي يكسرلك راسك على اساس انتي من اصحاب القرار روحي انقبري عالمطبخ ولا نقبري قعدي قدام قناة بداية وتركي السياسة لأهلها,0
1851,1616,1616,مدام جبران باسيل سرق و عمر بالمصاري قصر بمعراب، لك استحي يا عيب الشوم ع شعب البومة,0
2660,5077,5077,صح بشار ابن كلب بس قليل اللي عم يعملوا بالسوريين شعب عرص منافق بلا ضمير بيكون لاجئ بيصير بده يتطاول عللي مستضيفه,0
1099,3106,3106,يا اخي هيدا يهودي شو بفهمو بالفقه وتعاليم الاسلام يلعنو ويلعن سلالته,1
4344,3609,3609,ولك خرااااس العمى بقلبك شو كتتتتير حكي ومبعبع عالفاضي كلك وطخنك معبى هوا العمى بقلبك ما أتقل دمك العقاب لوهاب ,1
354,604,604,مشيخة السرقة وباكاوية النهب والكذب والدجل والعمالة ,0
3497,1549,1549,الله يلعن هيك دولة على هيك زعماء ,0
3358,377,377,جريدة اخبار وصرمايتنا سوا معانيك هيدا كلام من مدرستك مدرسة صرامي هيك تعلمتها منك هيدي الجملة ,1
1357,1419,1419,وهاب ابن الكلاب,1
991,3181,3181,ما تكون مفكر جبران باسيل اله لا يا عمي زلمي متلتنا متلو,2
4620,4124,4124,لك العما بعيون عيونك شو انك حيوان وبهيم وعديم الاحساس العما يا جحش لسه كل ما تنبح وتغرد بتاكل مية بهدلة والف مسبة روح انطم بقى وحط صرماية بحلقك وحاجتك اكل خر يلعنك ويلعن معلمك الحيوان بشار المماتع قال دكتور مناضل قال اتفووووووو ع شرفك وشرفه اذا في عندكم شرف,1
3008,1517,1517,شعوب بتسوا صرامي,0
4586,3549,3549,عقصة غدر هيدا العهر وناموس يطعن بالضهر حك بصبر بس القهر انك ما تعرف كيف هربِت من الشباك,1
2102,4436,4436,تيار العار البرتقالي هو تيار الغدر كما غدرو بالحكيم والقوات وانقلبوا على اتفاق معراب ينقلبون الان على الشيخ سعد الحريري تفوووووو على الشريف فيكم,0
3060,874,874,عدا عن جحاشة الأخ البلوشي ومعلوماته الخاطئة تماما عن الاشوريين والكلدان,1
130,3206,3206,انت درزي يا كلب يا فيصل زباله القاسم هذا موضوع لا علاقة له بك يا واطي يا قذر يا عميل و مشرد و كلب الدروز النباح عليه كول من البياره اللي انت فيها و قفل نيعك يا كلب,0
3805,1584,1584,وحمرنتك,1
1864,103,103,فهمتوا يا حقودين يا جماعة الحركة,0
1627,2517,2517,نعم قطر مجرمه ولكن المجرم الأكبر عندكم والمدعو حسن نصر الشيطان ومعه ملالي إيران والعثماني اردوغان اتحدو  ,0
4476,10,10,لو الدولة تحترم نفسها كان انت يالبلطجي في السجن ,1
351,3135,3135,أنا واحد من البشر بكره الفلاحين,0
2871,4181,4181,روحي انقبري انشغلي بشي عمستوى تفكيرك الخرا وتركينا من تنظيراتك وفلسفتك لا تدخلي فينا ويلا عالمطبخ,0
2308,4237,4237,يا عيني ملا جريدة الاخبار ,2
1894,5629,5629,ولا ساقط اكبر من حجمو ,1
1937,5105,5105,جبران باسيل لا يمثلني يمثل نفسه والعيلة وحزب اللَّات الارهابي,0
4326,3453,3453,يلعنك منافق,1
2596,2459,2459,وهاب لقاء خلدة ليس موجها ضد أحد ,2
336,1700,1700,من يستحقها ، الاقوى في بيئته اعتقد واجزم أن جبران باسيل سيكون الاقوى من ناحية التمثيل النيابي,2
93,2885,2885,مين هالحشرة ليرسل وفد هههههههه بجد مجانين انه بأخبار العاشرة بكاراكاس هذا و قد زار وفد م  ,1
2860,4113,4113,واحد غجري نوري قرباطي,0
4194,5816,5816,مع إنطلاق هذا الأسبوع ستولد الحكومة وكل المصادر تؤكد ذلك معالي الوزير جبران باسيل سيعود اليوم من فرنسا وسيلتحق به الرئيس,2
870,4756,4756,هيدا بغل الجاهلية وئام وهاب فتنة مزروعة بالجبل الله يقبرو منعرف عنو ما بيعرف حمار ما بيعرف يقرا ,1
881,4538,4538,ما حدا شايفاك بس حسن نصرالله يقول خراس بتخرس,1
753,3651,3651,لحكي موجه لجحاش اربعطعش الشهر وكل شي عدا ذلك وخاصة أهل المقاومة عراسي من فوق ,0
2,2318,2318,عثمان من أنصاف الرجال ,1
1143,4841,4841,ليك يا زمك عروف حالك شو عم تحكي مين انت اساسا لو انك زلمي كنت بتحط اسمك مش اسم مستعار يا لبناني يا هبيل انت فا فرقنا بريحة طيبة احسنلك يا حثالة المجتمع,0
763,4885,4885,مستواكم معروف اوطى من الصرامي لانكم  بلا شرف وادبكم الشتيمة,1
4140,27,27,ما الغريب الا الشيطان معقول بتستخفوا بعقول مناصرينكن بانه شيخ عقل حطوا عقل الرحمن براسكن وما الكن ال… ,2
3193,5763,5763,اذا جبران باسيل خائن,1
2318,436,436,قطيش هو كلب الحراسة الذي وظيفته أن ينبح حماية لأسياده وأولياء نعمته الذين يكرمونه بالعظمة آخر النهار,1
3464,2442,2442,معقول وهاب و ارسلان عم يشربو من الليطاني لتفكيرن هيك خرا ,0
2044,1427,1427,منور استاذ وئام ,2
724,3483,3483,شاحت الوجييه الله يخزيه وين ماكان هو وعزمي فشاره والعصملي حريم السلطان ,1
806,1779,1779,سمعت بك صباب القهوه عند وليد بيك وماصدقت لكن لان بدون شك صادق ,2
1089,1335,1335,يا ريت هالغشيم بس يشوف الكومنتس العمى ما اسطلو ,1
443,2233,2233,اذا بري راس الافعى الطائفية شو خليت لأسود القلب ولجبران باسيل طالعين نازلين المسحيين كذ…,0
4112,1390,1390,دخلك مش اسيادك يلي قتلو الشهيد وسام الحسن؟ دخلك مشكنتو تسبو في طالع نازل؟ خراس يا منافق دم زلمتك برقبتكن ,1
4195,2920,2920,سوري  وعم تطاول ع اسيادك ولك انتو ما بتستحو  ولا يا كلب يا صرصور هربتو من بلدكن اقل من نسوان  وراحوا رجالنا اللبنانيي نضفوا وراكن يا جربان ,0
4393,2719,2719,المفروض بس وزير الداخلية الحيوان زيهوفر منه وعليه بيرحل السوريين الحجة يلي أخدوها لما صاروا يقولوا الناس لازم تروح عالسفارة كانت إنه الناس أصلاً كانت تروح بإرادتها على السفارة وحتى في تيوس نازلين سوريا بوثيقة السفر,1
4244,4337,4337,كلمة تشبيح ماركة مسجلة لمؤيدي طرطور فارس بسوريا وطراطيره بمتصرفية لبنان بدولة فارس ,1
1852,312,312,كم تعداد الجيش الاردني؟,2
110,2789,2789,سؤال لشيخك وشخ خلدة الغريب ايران بلد عربي ام اميركي ؟   اذا عرف الجواب منعينه     ,2
3552,2710,2710,دام إن الخارجيه لحزب القوات اللبناني سمير جعجع مو أولى وأفضل بمية مره من جبران باسيل,2
3429,4792,4792,مصادر حزب الله ل القوات لو سمحتو سدو نيعكن العمه شو جحاش,0
3571,3765,3765,يا حقير روح انضب وصواريخك ادحشن سلاحكم هو لمحاربة السنة وغيرهم في المنطقة وانتو صرتو مرتزقة غب الطلب,1
4617,2058,2058,واللله الخراب من ملككم السادس الي خلى بنات المغرب متعة للقطريين وغيرهم ,0
1956,180,180,صباح الكسمك يا ميونخ يا مدينة خرى بنت وسخة,0
1754,3431,3431,من كل عقلك بعد في حدا او مرجع كبير بهالبلد؟ من ورا عمايلكم البلد كله بمن فيه صار صغير صغير صغير الله ينتقم منكم ,2
1886,2694,2694,كل العرب جرب ,0
3478,2260,2260,السيد طلب نحب بعض لك يقبرني جبران باسيل انا ❤❤,2
1010,1025,1025,ما هذه السذاجة معاليك؟؟؟ ,2
917,3132,3132,صادق ,2
4275,3566,3566,يلعن هل صباح ما اقرفك  ,1
845,4022,4022,يعني انت جبران باسيل,2
1076,1448,1448,لأنه كلاب عالم متل طارق خوري وغيره,1
1479,3942,3942,لعنك الله يا موريتاني ياقذر اصلا انت بلا شرف وماتربيت زي الناس يا جزمة الرجال ميت رحمه الله,0
1769,594,594,لكل دوله رجالها الا وئام وهاب فهو للامارات وايران معا ,2
3445,2068,2068,مش محبةً بقطر او بالعهد بس عنجد وحياتك ما حدا قاريك ارفتنا يا زلمي و عم تحكي كأنك بريئ و انت متلك متلون… ,1
202,2144,2144,حبيب البغل روح انقبر كول و نام,1
1210,4448,4448,ليه في دولة أصلا غير على الفقير والضعيف  وكانت نتيجته احمد الله يرحمه ,2
2079,2251,2251,انت اول واخر عاهر وبوق ارهابي للمجرم بشار ورئيس عصابة ولي الفقيه انت احقر انسان واتفه بشر خرااا علي ابو… ,1
1243,5294,5294,فشرت ولاك حيوان وهابي كلب ساعتك قريبة يالقيط,0
1093,3279,3279,يخسون إذا ما مرغوا خشوم تشلاب روسيا بالوحل يا قالي,1
4478,1463,1463,لو مانك جبان بلا منقودية يعني كنت كتبت هالتعليق من الاول,1
2894,3145,3145,شووو بتئول يامعرص هذا حساب حماراتي ريحت وزار وصخ يابو ريكي   ,1
1423,3731,3731,بس ولي انضبي بقا عمرك شفتي قواتجي بيفهم,0
2645,3133,3133,ناهب الدولة مش خائن,2
4242,5492,5492,اسرائيل ترد على جبران باسيل حديثه لل سي ان ان عن حق اسرائيل هو كلام من باب تمسيح الجوخ وتبيض الطناجر ليصل الى رئاسة الجمهورية,2
3958,2338,2338,ومحلي هلق من الاعراب اني بكره جبران باسيل متل ما مل هل الطوايف بتكرهو وبرجع بقلك بحكي واقع الناس يلي انتو نهبتو وقمعتوا ,2
2251,1629,1629,رجعت من الإمارات معاليك ولا بعدك هونيك؟ ,2
3695,3083,3083,سدو يا خروف قوى نبضك هلق العقاب لوهاب وهاب قاتل ابو دياب ,1
3319,4209,4209,أعلنت جامعة اوكسفورد البريطانية عن منح الوزير جبران باسيل دكتوراه فخرية في العلوم الإقتصادية,2
4268,778,778,بفهمك يمكن صعبة عليك تشوف إنسان ناجح و نظيف متل جبران باسيل,2
2764,397,397,الجيش الاسود لا تعليق بس هيك ,2
3617,3138,3138,واحد مكيف إنه النهيق تبعه أموي شو بده يطلع منه,0
2407,5283,5283,روح ولاك تعلم تاريخ وادب بعدين تعال ناقش يا طائفي يا وهابي,0
3402,407,407,طيب ياخي تلحس انت ويلي لاحقك علم لا ينفع متل الخرى بس شغل صف كلام بلا اي طعمة,1
4516,1804,1804,اذا عاجبينك شفافي تعا خدلك كم بزقة منن بلكي بتزورك البركة حزومي    ,1
855,5838,5838,سعد الحريري ينصر جبران باسيل ضد وزيره المرعبي في موضوع النازحين السوريين,2
984,5186,5186,شو خص جبران باسيل ما فهمنا  ,2
748,1400,1400,مكتوب على الشعب السعودي الجحشنة ومصرّين تضلو حمير يعني,0
3754,4190,4190,كول هوا يا ابن الكلب,1
703,4923,4923,احلا زلمة والله ,2
491,247,247,معالي لبناني وطني مش سعودي ليسافر ,2
1359,5623,5623,وانت صغير يا فتنجي ,1
430,1042,1042,اتمنى من الدوله بعد ان صف الجرذ جبران باسيل اللبناني وزير خارجية لبنان بصف دويلة قطر ووصف المقاطعه بالحصاار ان يتم ترحيل اللبن…,0
34,2609,2609,ما بستغرب انو الصهيوني يدخل بمقتل الشهيد محمد حتى يخفي ايدو بالموضوع ,2
2124,5577,5577,ليك يا خريو حبيبي والله ما تزعل مني بس قسم بالله سعد الحريري ما شايفك بس شايف ع طرزك كتير يلله غالوبس ينعن شكلك ,1
